,bab,ayat,jawa,indo
292,2 Samuel 12,8,"Ingsun wus maringake sakukubaning daleme gustinira marang sira, apadene para garwane ana ing pangkonira. Ingsun wus maringake tedhak-turune Israel lan Yehuda marang sira; lan saupama iku durung cukup mesthi sunwuwuhi maneh apa bae marang sira.","Telah Kuberikan isi rumah tuanmu kepadamu, dan isteri-isteri tuanmu ke dalam pangkuanmu. Aku telah memberikan kepadamu kaum Israel dan Yehuda; dan seandainya itu belum cukup, tentu Kutambah lagi ini dan itu kepadamu."
293,2 Samuel 12,9,Yagene sira kok nyawiyah marang Sang Yehuwah kanthi tindakira kang ala ana ing paningale Sang Yehuwah? Uria wong Het iku kok sira pateni klawan pedhang; bojone sira alap lan Uria sira purih patine srana pedhange bani Amon.,"Mengapa engkau menghina TUHAN dengan melakukan apa yang jahat di mata-Nya? Uria, orang Het itu, kaubiarkan ditewaskan dengan pedang; isterinya kauambil menjadi isterimu, dan dia sendiri telah kaubiarkan dibunuh oleh pedang bani Amon."
294,2 Samuel 12,10,"Mulane pedhang ora bakal gumingsir saka tedhak turunira ing salawase, amarga sira wus ngremehake Ingsun lan ngalap bojone Uria wong Het iku sira dadekake bojonira.","Oleh sebab itu, pedang tidak akan menyingkir dari keturunanmu sampai selamanya, karena engkau telah menghina Aku dan mengambil isteri Uria, orang Het itu, untuk menjadi isterimu."
295,2 Samuel 12,11,"Makaten pangandikanipun Sang Yehuwah: Lah Ingsun bakal ndhawahake bilai marang sira kang timbul saka kulawarganira dhewe. Ingsun bakal mundhut para rabinira ana ing ngareping mripatira lan Sunparingake marang wong liyane, kang bakal nuroni iku ing wayah awan.",Beginilah firman TUHAN: Bahwasanya malapetaka akan Kutimpakan ke atasmu yang datang dari kaum keluargamu sendiri. Aku akan mengambil isteri-isterimu di depan matamu dan memberikannya kepada orang lain; orang itu akan tidur dengan isteri-isterimu di siang hari.
296,2 Samuel 12,12,"Awit dene sira wus tumindak klawan dhedhemitan, nanging Ingsun bakal nindakake prakara iku ana ing ngarepe wong Israel kabeh klawan blak-blakan.”","Sebab engkau telah melakukannya secara tersembunyi, tetapi Aku akan melakukan hal itu di depan seluruh Israel secara terang-terangan."""
297,2 Samuel 12,13,"Prabu Dawud banjur ngandika marang Nabi Natan: “Kula sampun nglampahi dosa wonten ing ngarsanipun Sang Yehuwah.” Lan Nabi Natan matur marang Prabu Dawud: “Sang Yehuwah sampun ngruwat dosa dalem, panjenengan dalem boten badhe seda.","Lalu berkatalah Daud kepada Natan: ""Aku sudah berdosa kepada TUHAN."" Dan Natan berkata kepada Daud: ""TUHAN telah menjauhkan dosamu itu: engkau tidak akan mati."
298,2 Samuel 12,14,"Ewasemanten sarehne panjenengan dalem kanthi tumindak makaten punika, sampun damel sanget kuceming asmanipun Pangeran Yehuwah, putra ingkang miyos saking panjenengan dalem punika, mesthi badhe seda.”","Walaupun demikian, karena engkau dengan perbuatan ini telah sangat menista TUHAN, pastilah anak yang lahir bagimu itu akan mati."""
299,2 Samuel 12,15,"Nabi Natan banjur kondur lan Sang Yehuwah nggebag putra kang miyos saka tilase somahe Uria, kang patutan karo Sang Prabu Dawud, temah gerah.","Kemudian pergilah Natan ke rumahnya. Dan TUHAN menulahi anak yang dilahirkan bekas isteri Uria bagi Daud, sehingga sakit."
300,2 Samuel 12,16,"Sang Prabu Dawud nyenyuwun marang Gusti Allah kanggo kang putra iku, panjenengane nglampahi siyam kanthi tumemen lan bareng lumebet ing dalem sawengi natas tansah nggluntung ana ing jogan.","Lalu Daud memohon kepada Allah oleh karena anak itu, ia berpuasa dengan tekun dan apabila ia masuk ke dalam, semalam-malaman itu ia berbaring di tanah."
301,2 Samuel 12,17,"Para tuwa-tuwane abdi dalem ngarih-arih supaya Sang Prabu jumeneng saka ing jogan, nanging ora karsa; uga ora karsa kembul dhahar karo wong-wong iku.","Maka datanglah kepadanya para tua-tua yang di rumahnya untuk meminta ia bangun dari lantai, tetapi ia tidak mau; juga ia tidak makan bersama-sama dengan mereka."
302,2 Samuel 12,18,"Bareng ing pitung dinane kang putra nemahi seda. Lan para abdi dalem padha wedi ngaturi uninga marang Sang Prabu, yen kang putra wus seda. Amarga para abdi dalem padha rasanan: “Nalika kang putra isih sugeng, aku wus padha matur marang Sang Prabu, nanging aturku ora digalih. Kapriye anggonku arep padha matur, yen kang putra wis seda? Aja nganti Sang Prabu mbilaeni sarira.”","Pada hari yang ketujuh matilah anak itu. Dan pegawai-pegawai Daud takut memberitahukan kepadanya, bahwa anak itu sudah mati. Sebab mereka berkata: ""Ketika anak itu masih hidup, kita telah berbicara kepadanya, tetapi ia tidak menghiraukan perkataan kita. Bagaimana kita dapat mengatakan kepadanya: anak itu sudah mati? Jangan-jangan ia mencelakakan diri!"""
303,2 Samuel 12,19,"Nalika Sang Prabu nguningani, yen para abdi padha bebisikan, Sang Prabu ngretos, manawa kang putra wus seda. Sang Prabu banjur ndangu marang abdi dalem: “Bocahe apa wus mati?” Atur wangsulane para abdi “Nuwun inggih, sampun seda.”","Ketika Daud melihat, bahwa pegawai-pegawainya berbisik-bisik, mengertilah ia, bahwa anak itu sudah mati. Lalu Daud bertanya kepada pegawai-pegawainya: ""Sudah matikah anak itu?"" Jawab mereka: ""Sudah."""
304,2 Samuel 12,20,"Sang Prabu banjur jumeneng saka ing jogan, siram lan ngagem lenga jebad sarta santun pangageman; panjenengane lumebet ing padalemane Sang Yehuwah lan sujud manembah. Sawuse iku banjur kondur menyang kraton lan mundhut roti nuli iya disaosi sarta banjur dhahar.","Lalu Daud bangun dari lantai, ia mandi dan berurap dan bertukar pakaian; ia masuk ke dalam rumah TUHAN dan sujud menyembah. Sesudah itu pulanglah ia ke rumahnya, dan atas permintaannya dihidangkan kepadanya roti, lalu ia makan."
305,2 Samuel 12,21,"Para abdi dalem banjur padha munjuk: “Punapa wadosipun ingkang panjenengan dalem lampahi punika? Nalika putra dalem taksih sugeng, panjenengan dalem siyam saha tansah muwun, mangka sareng putra dalem seda panjenengan dalem kok lajeng jumeneng tuwin dhahar?”","Berkatalah pegawai-pegawainya kepadanya: ""Apakah artinya hal yang kauperbuat ini? Oleh karena anak yang masih hidup itu, engkau berpuasa dan menangis, tetapi sesudah anak itu mati, engkau bangun dan makan!"""
306,2 Samuel 12,22,"Pangandikane Sang Prabu: “Nalika bocah iku isih urip, aku puasa lan nangis, amarga pangunandikaku: Bokmanawa Sang Yehuwah karsa melasi marang aku, temah bocah iku lestari urip.","Jawabnya: ""Selagi anak itu hidup, aku berpuasa dan menangis, karena pikirku: siapa tahu TUHAN mengasihani aku, sehingga anak itu tetap hidup."
307,2 Samuel 12,23,"Nanging sarehne saiki wis mati apa perlune aku isih puwasa? Apa bocah iku bisa bali maneh marang aku? Aku kang bakal nusul bocah iku, nanging bocah iku ora bakal bali marang aku.”","Tetapi sekarang ia sudah mati, mengapa aku harus berpuasa? Dapatkah aku mengembalikannya lagi? Aku yang akan pergi kepadanya, tetapi ia tidak akan kembali kepadaku."""
308,2 Samuel 12,24,"Sang Prabu Dawud banjur ngimur-imur galihe Sang Putri Batsyeba, kang garwa; panjenengane banjur ngrawuhi Sang Putri sarta nunggil sare; lan Sang Putri banjur mbabar putra kakung, Sang Prabu Dawud maringi asma Suleman. Sang Yehuwah ngasihi marang putra iku","Kemudian Daud menghibur hati Batsyeba, isterinya; ia menghampiri perempuan itu dan tidur dengan dia, dan perempuan itu melahirkan seorang anak laki-laki, lalu Daud memberi nama Salomo kepada anak itu. TUHAN mengasihi anak ini"
309,2 Samuel 12,25,"lan lumantar Nabi Natan maringi asma Yedija, marga saka karsane Sang Yehuwah.","dan dengan perantaraan nabi Natan Ia menyuruh menamakan anak itu Yedija, oleh karena TUHAN."
310,2 Samuel 12,0,Paprangan nglawan bani Amon wis rampung,Perang melawan bani Amon berakhir
311,2 Samuel 12,26,"Senapati Yoab andon perang nglawan Raba, kuthane bani Amon lan mbedhah kuthane krajan.","Yoab berperang melawan Raba, kota bani Amon dan ia merebut kota kerajaan."
312,2 Samuel 12,27,Senapati Yoab utusan wong marang ngarsane Sang Prabu Dawud sarta diwekas: “Kawula sampun andon perang nglawan kitha Raba lan ugi sampun mbedhah kitha pinggir lepen.,"Lalu Yoab menyuruh orang kepada Daud dengan pesan: ""Aku berperang melawan kota Raba, dan telah merebut pula kota air."
313,2 Samuel 12,28,"Pramila panjenengan dalem kawula aturi nglempakaken kekantuning wadyabala, kitha punika panjenengan dalem kepang lan panjenengan dalem bedhah, supados sampun ngantos kawula ingkang mbedhah kitha punika lan sampun ngantos nama kawula ingkang kocap wonten ing kitha punika.”","Oleh sebab itu, kumpulkanlah sisa tentara, kepunglah kota itu dan rebutlah, supaya jangan aku yang merebut kota itu dan jangan namaku menjadi juga nama kota itu."""
314,2 Samuel 12,29,"Sawuse iku Prabu Dawud nglempakake sakehing wadyabala, banjur nglurug menyang ing kutha Raba, lan perang nglawan kutha iku, banjur kabedhah.","Sesudah itu Daud mengumpulkan seluruh tentara, ia berangkat ke kota Raba dan berperang melawannya, lalu merebutnya."
315,2 Samuel 12,30,"Panjenengane mundhut makuthaning ratune bobote satalenta mas, tinatah mawa sesotya kang larang regane, nuli diagem ing mastakane. akeh barang jarahan kang diusungi saka ing kutha iku.","Ia mengambil mahkota dari kepala raja mereka, beratnya setalenta emas, bertatahkan sebuah batu permata yang mahal dan itu dikenakan pada kepala Daud. Juga diangkutnya banyak sekali jarahan dari kota itu."
316,2 Samuel 12,31,"Wong isine kutha padha diboyongi lan dipeksa nglakoni pagawean mawa graji, bur lan wadung wesi; uga dikon nyambutgawe ana ing panggonan nyithak bata. Sakehe wong ing kutha-kutha bani Amon uga ditrapi gawean mengkono dening Sang Prabu Dawud. Sawuse mangkono Prabu Dawud nuli kondur menyang Yerusalem kadherekake wadyabala kabeh.","Penduduk kota itu diangkutnya dan dipaksanya bekerja dengan gergaji, penggerek besi dan kapak; juga dipekerjakannya mereka di tempat pembuatan batu bata. Demikianlah juga diperlakukan Daud segala kota bani Amon. Sesudah itu pulanglah Daud dengan seluruh tentara ke Yerusalem."
317,2 Samuel 13,0,Pangeran Amnon lan Sang Putri Tamar,Amnon dan Tamar
318,2 Samuel 13,1,"Sawuse iku ana lelakon kaya ing ngisor iki: Pangeran Absalom, putrane Sang Prabu Dawud kagungan rayi putri kang ayu warnane, asmane Tamar: lan Sang Amnon putrane Sang Prabu Dawud kasmaran marang putri iku.","Sesudah itu terjadilah yang berikut. Absalom bin Daud mempunyai seorang adik perempuan yang cantik, namanya Tamar; dan Amnon bin Daud jatuh cinta kepadanya."
319,2 Samuel 13,2,"Galihe Pangeran Amnon wuyung banget, temah nandhang gerah marga saka Sang Putri Tamar, sadhereke iku, amarga Sang Putri iku isih kenya lan miturut pangrasane Pangeran Amnon, langka bisane nandukake apa-apa marang panjenengane.","Hati Amnon sangat tergoda, sehingga ia jatuh sakit karena Tamar, saudaranya itu, sebab anak perempuan itu masih perawan dan menurut anggapan Amnon mustahil untuk melakukan sesuatu terhadap dia."
320,2 Samuel 13,3,"Pangeran Amnon kagungan mitra, asmane Yonadab, putrane Sang Simea, kang raka Sang Prabu Dawud. Sang Yonadab iku wong kang pinter banget.","Amnon mempunyai seorang sahabat bernama Yonadab, anak Simea kakak Daud. Yonadab itu seorang yang sangat cerdik."
321,2 Samuel 13,4,"Ature marang Pangeran Amnon: “Dhuh Sang Rajaputra, kenging punapa dene panjenengan dalem saben enjing kok ketingal suntrut makaten? Punapa boten langkung prayogi panjenengan dalem paring sumerep dhateng kawula?” Pangandikane Pangeran Amnon marang Sang Yonadab: “Kula remen dhateng Tamar, rayinipun adhimas Absalom, sadherek kula.”","Katanya kepada Amnon: ""Hai anak raja, mengapa engkau demikian merana setiap pagi? Tidakkah lebih baik engkau memberitahukannya kepadaku?"" Kata Amnon kepadanya: ""Aku cinta kepada Tamar, adik perempuan Absalom, saudaraku itu."""
322,2 Samuel 13,5,"Ature sang Yonadab: “Panjenengan dalem kawula aturi sare wonten ing pasarean lan api-api gerah. Samangsa kang rama rawuh tetuwi, panjenengan matur makaten: Rayi kula Tamar mugi keparengna ngladosi tetedhan dhateng kawula. Anggenipun ngolahaken tetedhan punika wontena ing ngajeng kawula, temah kawula saged nungkuli, sarta kawula sageda nedha saking tanganipun.”","Lalu berkatalah Yonadab kepadanya: ""Berbaringlah di tempat tidurmu dan berbuat pura-pura sakit. Apabila ayahmu datang menengok engkau, maka haruslah engkau berkata kepadanya: Izinkanlah adikku Tamar datang memberi aku makan. Apabila ia menyediakan makanan di depan mataku, sehingga aku dapat melihatnya, maka aku akan memakannya dari tangannya."""
323,2 Samuel 13,6,"Sawuse iku Pangeran Amnon sarean lan api-api gerah. Nalika Sang Prabu Dawud rawuh tetuwi, Pangeran Amnon munjuk marang Sang Prabu: “Rayi kawula Tamar mugi kaparengna dhateng ngolahaken kuwih-kuwih satunggal kalih wonten ing ngajeng kawula, supados kawula tedha saking tanganipun.”","Sesudah itu berbaringlah Amnon dan berbuat pura-pura sakit. Ketika raja datang menengok dia, berkatalah Amnon kepada raja: ""Izinkanlah adikku Tamar datang membuat barang dua kue di depan mataku, supaya aku memakannya dari tangannya."""
324,2 Samuel 13,7,"Sang Prabu banjur utusan abdi marani Sang Putri Tamar, menyang ing daleme sarta kaweling: “Menyanga ing omahe kangmasmu Amnon lan olahna panganan.”","Lalu Daud menyuruh orang kepada Tamar, ke rumahnya, dengan pesan: ""Pergilah ke rumah Amnon, kakakmu dan sediakanlah makanan baginya."""
325,2 Samuel 13,8,"Sang Putri Tamar banjur tindak menyang ing daleme Pangeran Amnon, kang raka kang lagi sarean. Sang Putri Tamar banjur mundhut jladren diulet lan diolah kagawe panganan, ana ing ngarsane Pangeran Amnon, nuli kapanggang.","Maka Tamar pergi ke rumah Amnon, kakaknya, yang sedang berbaring-baring, lalu anak perempuan itu mengambil adonan, meremasnya dan membuat kue di depan matanya, kemudian dibakarnya kue itu."
326,2 Samuel 13,9,"Sawuse iku Sang Kenya mundhut wajane lan ngesok isine ana ing ngarsane Pangeran Amnon, nanging ora kersa dhahar. Pangeran Amnon ngandika: “Wong kabeh padha konen metu saka ing kene.” Wong kabeh banjur padha metu saka ing kono.","Sesudah itu gadis itu mengambil kuali dan mengeluarkan isinya di depan Amnon, tetapi ia tidak mau makan. Berkatalah Amnon: ""Suruhlah setiap orang keluar meninggalkan aku."" Lalu keluarlah setiap orang meninggalkan dia."
327,2 Samuel 13,10,"Pangeran Amnon banjur ngandika marang kang rayi Tamar: “Panganane gawanen menyang kamar, supaya aku mangan saka ing tanganmu.” Sang Putri mundhut panganan olah-olahane, nuli diaturake marang kang raka Amnon menyang ing jero kamar.","Lalu berkatalah Amnon kepada Tamar: ""Bawalah makanan itu ke dalam kamar, supaya aku memakannya dari tanganmu."" Tamar mengambil kue yang disediakannya itu, lalu membawanya kepada Amnon, kakaknya, ke dalam kamar."
328,2 Samuel 13,11,"Bareng Sang Putri nyaosake dhaharan, Sang Putri kacandhak lan dipangandikani: “Ayo turu karo aku, dhiajeng!”","Ketika gadis itu menghidangkannya kepadanya supaya ia makan, dipegangnyalah gadis itu dan berkata kepadanya: ""Marilah tidur dengan aku, adikku."""
329,2 Samuel 13,12,"Nanging Sang Putri matur marang Amnon, kang raka: “Boten kangmas, sampun panjenengan masesa kula, amargi lampah makaten punika boten urus wonten ing Israel. Panjenengan sampun ngantos tumindak nistha makaten.","Tetapi gadis itu berkata kepadanya: ""Tidak kakakku, jangan perkosa aku, sebab orang tidak berlaku seperti itu di Israel. Janganlah berbuat noda seperti itu."
330,2 Samuel 13,13,"Punapa malih badhe dhateng pundi anggen kula nyingkiraken kawirangan kula punika? Dene panjenengan punika, panjenengan badhe kagolongaken tiyang gemblung wonten ing Israel. Pramila panjenengan kula aturi matur dhateng Sang Prabu, awit panjenenganipun temtu boten badhe nyukengi kula, temtu karsa maringaken kula dhateng panjenengan.”","Dan aku, ke manakah kubawa kecemaranku? Dan engkau ini, engkau akan dianggap sebagai orang yang bebal di Israel. Oleh sebab itu, berbicaralah dengan raja, sebab ia tidak akan menolak memberikan aku kepadamu."""
331,2 Samuel 13,14,"Nanging Pangeran Amnon ora maelu marang ature kang rayi; lan sarehne luwih rosa katimbang Sang Putri, dirodapeksa lan ditunggil sare.","Tetapi Amnon tidak mau mendengarkan perkataannya, dan sebab ia lebih kuat dari padanya, diperkosanyalah dia, lalu tidur dengan dia."
332,2 Samuel 13,15,"Wasana Pangeran Amnon katuwuhan rasa sengit kang luwih banget marang Sang Putri, malah rasane sengit ngluwihi rasane remen marang kang rayi ing sadurunge. Pangeran Amnon ngandika marang Sang Putri: “Ngadega lan lungaa!”","Kemudian timbullah kebencian yang sangat besar pada Amnon terhadap gadis itu, bahkan lebih besar benci yang dirasanya kepada gadis itu dari pada cinta yang dirasanya sebelumnya. Lalu Amnon berkata kepadanya: ""Bangunlah, enyahlah!"""
333,2 Samuel 13,16,"Sang Kenya matur: “Sampun tumindak makaten dhuh kakangmas, anggen panjenengan nundhung kula punika langkung awon katimbang kaliyan ingkang sampun panjenengan tandukaken dhateng kula.” Nanging Pangeran Amnon ora maelu marang ature Sang Putri.","Lalu berkatalah gadis itu kepadanya: ""Tidak kakakku, sebab menyuruh aku pergi adalah lebih jahat dari pada apa yang telah kaulakukan kepadaku tadi."" Tetapi Amnon tidak mau mendengarkan dia."
334,2 Samuel 13,17,"Banjur nimbali abdine kang ngladeni, dhawuhe: “Wong wadon iku konen lunga saka kene, lawange nuli kuncinen!”","Dipanggilnya orang muda yang melayani dia, katanya: ""Suruhlah perempuan ini pergi dari padaku dan kuncilah pintu di belakangnya."""
335,2 Samuel 13,18,"Sang Putri ngagem rasukan alengen dawa kang endah banget, awit wis kalumrah putrining ratu kang isih kenya ngagem rasukan alengen dawa. Abdi mau banjur nundhung Sang Putri menyang njaba nuli lawange dikunci.","Gadis itu memakai baju kurung yang maha indah; sebab demikianlah puteri-puteri raja yang masih perawan berpakaikan baju kurung panjang. Kemudian pelayan itu menyuruh dia keluar, lalu mengunci pintu di belakangnya."
336,2 Samuel 13,19,"Sang Putri Tamar banjur nguwur-uwuri awu ing mastakane, nyuwek rasukane alengen dawa kang endah iku, nyunggi astane lan tindak muwun klawan swara dumeling.","Lalu Tamar menaruh abu di atas kepalanya, mengoyakkan baju kurung yang maha indah yang dipakainya, meletakkan tangannya di atas kepalanya dan pergilah ia sambil meratap dengan nyaring."
337,2 Samuel 13,20,"Pangeran Absalom, kang raka, ndangu marang Sang Putri: “Apa kangmasmu Amnon iku sapaturon karo kowe? Lah saiki, dhiajeng menenga bae, wong iku kangmasmu dhewe, prakara iku aja koklebokake ing atimu.” Sang Putri Tamar manggen nyepi ana ing daleme Pangeran Absalom kang raka.","Bertanyalah Absalom, kakaknya, kepadanya: ""Apakah Amnon, kakakmu itu, bersetubuh dengan engkau? Maka sekarang, adikku, diamlah saja, bukankah ia kakakmu, janganlah begitu memikirkan perkara itu."" Lalu Tamar tinggal di rumah Absalom, kakaknya itu, seorang diri."
338,2 Samuel 13,21,"Nalika Sang Prabu Dawud miyarsa prakara iku kabeh, banget muntab dukane.",Ketika segala perkara itu didengar raja Daud sangat marahlah ia.
339,2 Samuel 13,22,"Pangeran Absalom ora reraosan karo Pangeran Amnon kang ala utawa kang becik, nanging Pangeran Absalom ngrendhem sengit banget marang Pangeran Amnon, awit saka anggone masesa marang kang rayi Tamar.","Dan Absalom tidak berkata-kata dengan Amnon, baik tentang yang jahat maupun tentang yang baik, tetapi Absalom membenci Amnon, sebab ia telah memperkosa Tamar, adiknya."
340,2 Samuel 13,0,"Pangeran Amnon kasedanan, Pangeran Absalom ngungsi","Amnon dibunuh, Absalom melarikan diri"
341,2 Samuel 13,23,"Sawuse kelakon rong taun, Pangeran Absalom nganakake pahargyan mbathili wedhus-wedhuse ana ing Baal-Hazor, ing sacedhake kutha Efraim. Pangeran Absalom ngulemi para putrane Sang Prabu kabeh.","Sesudah lewat dua tahun, Absalom mengadakan pengguntingan bulu domba di Baal-Hazor yang dekat kota Efraim. Lalu Absalom mengundang semua anak raja."
342,2 Samuel 13,24,"Pangeran Absalom sowan marang ngarsane Sang Prabu, banjur munjuk: “Abdi dalem punika badhe ngadhah damel mbathili menda. Punapa Sang Prabu kepareng rawuh, kadherekaken para punggawa nyarengi lampah kawula?”","Kemudian Absalom menghadap raja, lalu berkata: ""Hambamu ini mengadakan pengguntingan bulu domba. Kiranya raja dan pegawai-pegawainya ikut bersama-sama dengan hambamu ini."""
343,2 Samuel 13,25,"Nanging Sang Prabu ngandika marang Absalom: “Aja dadi atinira putraningsun, ngger, yen kabeh padha mrana, mundhak gawe repotira.” Pangeran Absalom banget panyuwune, nanging Sang Prabu ora karsa tindak, mung paring pangestu.","Tetapi raja berkata kepada Absalom: ""Maaf, anakku, jangan kami semua pergi, supaya kami jangan menyusahkan engkau."" Lalu Absalom mendesak, tetapi raja tidak mau pergi, ia hanya memberi restu kepadanya."
344,2 Samuel 13,26,"Pangeran Absalom matur maneh: “Manawi panjenengan dalem boten karsa, kalilana kangmas kawula Amnon kemawon tindaka kaliyan kawula.” Nanging Sang Prabu ngandika: “Apa ta prelune kangmasmu Amnon melu karo kowe?”","Kemudian berkatalah Absalom: ""Kalau tidak, izinkanlah kakakku Amnon pergi beserta kami."" Tetapi raja menjawabnya: ""Apa gunanya ia pergi bersama-sama dengan engkau?"""
345,2 Samuel 13,27,"Ewadene sarehne Pangeran Absalom banget panyuwune, Pangeran Amnon dalah para putra liyane dililani melu.","Tetapi ketika Absalom mendesak, diizinkannyalah Amnon dan semua anak raja pergi beserta dia."
346,2 Samuel 13,28,"Pangeran Absalom banjur mrentahi marang para abdine mangkene: “Padha diawas!” Manawa Amnon wis gambira marga saka sumuking anggur lan aku ngabani marang kowe: Amnon tempuhen, wong iku patenana. Aja wedi. Rak aku kang dhawuh marang kowe? diteteg atimu lan ngatokna gagah prakosamu.”","Lalu Absalom memerintahkan orang-orangnya, demikian: ""Perhatikan! Apabila hati Amnon menjadi gembira karena anggur, dan aku berkata kepadamu: Paranglah Amnon, maka haruslah kamu membunuh dia. Jangan takut. Bukankah aku yang memerintahkannya kepadamu? Kuatkanlah hatimu dan tunjukkanlah dirimu sebagai orang yang gagah perkasa!"""
347,2 Samuel 13,29,"Para abdine Pangeran Absalom nuli nandukake marang Pangeran Amnon apa saprentahe Pangeran Absalom. Sakehe putrane Sang Prabu banjur menyat, nitih bihale dhewe-dhewe lan padha lumajeng.","Orang-orang Absalom memperlakukan Amnon seperti yang diperintahkan Absalom. Lalu bangunlah semua anak raja itu, mereka menaiki bagalnya masing-masing dan melarikan diri."
348,2 Samuel 13,30,"Nalika para putrane Sang Prabu isih padha ana ing dalan Sang Prabu Dawud midhanget pawarta mangkene: “Pangeran Absalom sampun nyedani sakathahing putranipun Sang Prabu, boten wonten satunggal-tunggala ingkang saged lolos.”","Mereka masih di tengah jalan, ketika kabar sampai kepada Daud, demikian: ""Absalom telah membunuh semua anak raja, tidak ada seorangpun dari mereka yang lolos."""
349,2 Samuel 13,31,"Sang Prabu banjur jumeneng, nyuwek-nyuwek pangagemane lan dhawah gumuling ana ing jogan, tuwin sakehe abdi dalem kang ngadhep, padha nyuwek-nyuwek panganggone.","Lalu bangunlah raja, dikoyakkannya pakaiannya dan berbaring di lantai, dan semua pegawainya yang hadir padanya mengoyakkan pakaian mereka."
350,2 Samuel 13,32,"Nanging Sang Yonadab, bin Simea, kang raka Sang Prabu Dawud, tumuli matur: “Gusti sampun nginten bilih para mudha para putra dalem sadaya sami kasedanan. Namung Pangeran Amnon ingkang seda, amargi prakawis punika sampun katawis wonten ing pasuryanipun Pangeran Absalom, wiwit nalika Pangeran Amnon masesa Sang Putri Tamar, rayinipun.","Maka berbicaralah Yonadab, anak Simea, kakak Daud, katanya: ""Janganlah tuanku menyangka, bahwa semua orang muda anak-anak raja itu, telah dibunuh. Hanya Amnon yang mati, sebab hal itu telah terlihat pada air muka Absalom, sejak Amnon memperkosa Tamar, adiknya."
351,2 Samuel 13,33,"Pramila dhuh gusti kawula Sang Prabu, sampun nggalih, bilih sadaya putra dalem sampun seda, amargi namung Pangeran Amnon piyambak ingkang seda.”","Jadi, janganlah tuanku raja menaruh pikiran dalam hatinya, bahwa semua anak raja itu sudah mati, sebab hanya Amnon yang mati."""
352,2 Samuel 13,34,"Kacarita Pangeran Absalom lolos. Nalika wong jaga ngulat-ulatake, katon ana wong sagolongan gedhe teka saka ing dalan kang menyang Horonaim, saurute perenging gunung.","Absalom melarikan diri. Ketika orang yang berjaga-jaga melayangkan pandangnya, maka terlihatlah olehnya sejumlah besar orang datang dari jurusan Horonaim, sepanjang sisi pegunungan."
353,2 Samuel 13,35,"Sang Yonadab matur marang Sang Prabu: “Kauningana, para putra dalem sampun sami rawuh. Rak leres kados unjukipun abdi dalem.","Berkatalah Yonadab kepada raja: ""Lihat, anak-anak raja datang! Benar seperti kata hambamu ini."""
354,2 Samuel 13,36,"Lagi bae anggone munjuk, para putrane Sang Prabu padha sowan kalawan muwun kanthi sora. Sang Prabu iya muwun kalawan swara sora, mangkono uga sakehe abdi dalem.","Baru saja ia habis berkata, datanglah anak-anak raja itu. Mereka menangis dengan suara nyaring. Juga raja dan semua pegawainya menangis dengan amat keras."
355,2 Samuel 13,37,"Pangeran Absalom wus lolos lan ngungsi marang kratone Prabu Talmai bin Amihud, ratu ing tanah Gesur. Lan Sang Prabu Dawud nandhang sungkawa pirang-pirang dina marga saka putrane mau.","Absalom telah melarikan diri dan telah pergi kepada Talmai bin Amihur, raja negeri Gesur. Dan Daud berdukacita berhari-hari lamanya karena anaknya itu."
356,2 Samuel 13,38,Pangeran Absalom anggone lolos lan ngungsi ana ing kraton Gesur nganti telung taun.,Absalom telah melarikan diri dan telah pergi ke Gesur; ia tinggal di sana tiga tahun lamanya.
357,2 Samuel 13,39,"Sang Prabu wus lilih dukane marang Pangeran Absalom, amarga sungkawane jalaran saka sedane Pangeran Amnon wus lipur.","Lalu raja tidak lagi marah terhadap Absalom, sebab kesedihan hatinya karena kematian Amnon telah surut."
358,2 Samuel 14,0,Pangeran Absalom kondur,Absalom kembali
359,2 Samuel 14,1,"Bareng Senapati Yoab bin Zeruya mirsa, yen Sang Prabu Dawud kangen marang Pangeran Absalom,","Ketika Yoab, anak Zeruya, mengetahui, bahwa hati raja merindukan Absalom,"
