,bab,ayat,jawa,indo
490,2 Samuel 18,2,"Sang Prabu banjur ngabani wadyabala mangsah perang, kang sapretelon dipanggedheni dening Sang Yoab, kang sapretelon dening Sang Abisai bin Zeruya, sadhereke Sang Yoab lan sapretelon maneh kang dadi tetindhih Sang Itai, wong ing Gat. Sang Prabu Dawud banjur ngandika marang wong akeh: “Ingsun piyambak uga bakal mangsah perang bareng klawan sira.”","Lalu Daud menyuruh tentara itu maju berperang, sepertiga di bawah perintah Yoab, sepertiga lagi di bawah perintah Abisai, anak Zeruya, adik Yoab, dan sepertiga lainnya di bawah perintah Itai, orang Gat itu. Lalu berkatalah raja kepada rakyat: ""Aku juga akan maju berperang bersama-sama dengan kamu."""
491,2 Samuel 18,3,"Nanging unjuke wong akeh: “Panjenengan dalem sampun ngantos mangsah perang, amargi saupami kawula ngantos keplajeng, tiyang-tiyang punika boten badhe mreduli dhateng kawula sadaya, malah sanadyan sami pejah ingkang sepalih, mesthi sami boten mreduli dhateng kawula sadaya, nanging gusti kawula punika aosipun sami kaliyan panunggilan kawula sadasa ewu. Pramila langkung sae, bilih gusti kawula siyaga mbiyantu kawula saking kitha.”","Tetapi tentara itu berkata: ""Janganlah tuanku maju berperang; sebab apabila kami terpaksa melarikan diri, maka mereka tidak akan menghiraukan kami; bahkan sekalipun mati separuh dari pada kami, mereka tidak akan menghiraukan kami; tetapi tuanku sama harganya dengan sepuluh ribu orang dari pada kami. Sebab itu, adalah lebih baik, bahwa tuanku bersedia menolong kami dari kota."""
492,2 Samuel 18,4,"Sang Prabu banjur ngandika marang wong akeh iku: “Apa kang sira wawas becik, bakal sunlakoni.” Sang Prabu banjur jumeneng ana ing sandhing gapura lan wadyabala kabeh padha metu budhal pepanthan atusan lan ewon.","Kemudian berkatalah raja kepada mereka: ""Apa yang kamu pandang baik akan kuperbuat."" Lalu berdirilah raja di sisi pintu gerbang dan seluruh tentara itu berjalan ke luar, beratus-ratus dan beribu-ribu."
493,2 Samuel 18,5,"Lan Sang Prabu paring dhawuh marang Sang Yoab, Abisai lan Itai, pangandikane: “Pangrengkuhira marang Absalom, wong anom iku, sing alus, marga saka ingsun. “Lan wadyabala padha krungu kabeh, nalika Sang Prabu paring dhawuh marang para tetindhihing bala tumrap Pangeran Absalom iku.","Dan raja memerintahkan kepada Yoab, Abisai dan Itai, demikian: ""Perlakukanlah Absalom, orang muda itu dengan lunak karena aku."" Dan seluruh tentara mendengar, ketika raja memberi perintah itu kepada semua kepala pasukan mengenai Absalom."
494,2 Samuel 18,6,Wadyabala banjur mangkat menyang ing ara-ara nempuh marang bala Israel lan campuhing perang ana ing alas Efraim.,"Lalu tentara itu maju ke padang menyerang orang Israel, dan terjadilah pertempuran di hutan Efraim."
495,2 Samuel 18,7,Bala Israel temah padha kasoran kagepuk ing perang ana ing kono dening balane Prabu Dawud lan ing dina iku wutahing getih nggegirisi banget: wong kang tiwas rong puluh ewu.,"Tentara Israel terpukul kalah di sana oleh orang-orang Daud, dan pada hari itu terjadilah di sana pertumpahan darah yang dahsyat: dua puluh ribu orang tewas."
496,2 Samuel 18,8,Campuhing perang ngambra-ambra nyrambahi saindenging tlatah lan alas iku nekakake pepati luwih akeh katimbang karo kang mati kamangsa ing pedhang.,"Kemudian pertempuran meluas dari sana meliputi seluruh daerah itu, dan hutan itu memakan lebih banyak orang di antara tentara dari pada yang dimakan pedang pada hari itu."
497,2 Samuel 18,9,"Dumadakan Pangeran Absalom kepregok karo balane Sang Prabu Dawud. Anadene Pangeran Absalom nitih bihal, nalika bihal iku liwat ing sangisore bebuletaning pang wit tarbantin kang gedhe, mustakane kecantol ing wit ela iku, temah genteyongan ana ing antarane langit lan bumi, mangka bihal kang dititihi mbedhal terus.","Kebetulan Absalom bertemu dengan orang-orang Daud. Adapun Absalom menunggangi bagal. Ketika bagal itu lewat di bawah jalinan dahan-dahan pohon tarbantin yang besar, tersangkutlah kepalanya pada pohon tarbantin itu, sehingga ia tergantung antara langit dan bumi, sedang bagal yang dikendarainya berlari terus."
498,2 Samuel 18,10,"Bareng kaweruhan ing wong, dilapurake marang Senapati Yoab, ature: “Kula sumerep Pangeran Absalom genteyongan wonten ing wit ela.”","Seseorang melihatnya, lalu memberitahu Yoab, katanya: ""Aku melihat Absalom tergantung pada pohon tarbantin."""
499,2 Samuel 18,11,"Senapati Yoab banjur ngandika marang wong kang ngaturi pirsa iku: “Apa? Yen kowe meruhi, yagene ora kokbanting ing lemah ana ing kono. Wis sapatute yen aku banjur ngganjar kowe dhuwit sekel selaka sepuluh sekel lan sabuk siji.”","Yoab berkata kepada orang yang memberitahu kepadanya itu: ""Apa? Jika engkau melihatnya, mengapa engkau tidak membanting dia ke tanah di tempat itu juga? Maka selayaknya aku memberi engkau sepuluh syikal perak dan satu ikat pinggang."""
500,2 Samuel 18,12,"Nanging wong mau matur marang Senapati Yoab: “Sanadyan kula kaganjara selaka sewu sekel, kula boten badhe nggepok putranipun Sang Prabu, amargi kula sami mireng piyambak, pangandikanipun Sang Prabu dhateng panjenengan, Sang Abisai lan Itai, dhawuhipun: Wong anom Absalom iku ayomana marga saka ingsun.","Tetapi orang itu berkata kepada Yoab: ""Sekalipun aku mendapat seribu syikal perak di telapak tanganku, takkan aku menjamah anak raja itu, sebab di depan telinga kamilah raja memberi perintah kepadamu dan kepada Abisai dan kepada Itai, katanya: Lindungilah Absalom orang muda itu, karena aku."
501,2 Samuel 18,13,"Kosokwangsulipun, manawi kula ngantos nyedani panjenenganipun, boten sande prakawis punika kauningan dening Sang Prabu sarta panjenengan temtu badhe nebih kemawon.”","Sebaliknya, jika aku mencabut nyawanya dengan khianat tidak ada sesuatupun yang tinggal tersembunyi kepada raja--maka engkau akan menjauhkan diri."""
502,2 Samuel 18,14,"Nanging Senapati Yoab ngandika: “Aku ora arep nyenyuwe ana ing ngarepmu kaya mangkene.” Banjur mundhut towok telu lan dijojohake ing jajane Pangeran Absalom, nalika isih sugeng gumantung ana ing satengahing epange wit ela mau.","Tetapi Yoab berkata: ""Aku tidak mau membuang-buang waktu dengan kau seperti ini."" Lalu diambilnyalah tiga lembing dalam tangannya dan ditikamkannya ke dada Absalom, sedang ia masih hidup di tengah-tengah dahan pohon tarbantin itu."
503,2 Samuel 18,15,"Tumuli ana balane Senapati Yoab wong sepuluh, kang ngampil gegamane Sang Yoab, kang banjur ngepung Pangeran Absalom. Sang Pangeran digebagi lan disedani.","Kemudian sepuluh bujang, pembawa senjata Yoab, mengelilingi Absalom, lalu memukul dan membunuh dia."
504,2 Samuel 18,16,"Senapati Yoab banjur ngunekake kalasangka, dadine para balane Sang Yoab padha mandheg anggone ngoyak-oyak marang bala Israel, amarga Senapati Yoab nyandet balane.","Sesudah itu Yoab meniup sangkakala, sehingga tentara berhenti mengejar orang Israel; sebab Yoab mau menahan tentaranya itu."
505,2 Samuel 18,17,"Banjur padha ngudhunake layone Pangeran Absalom lan dicemplungake ana ing luwangan kang gedhe ing alas kono, nuli didegi tumpukan watu kang gedhe banget. Sakehe bala Israel mlayu nggendring mulih marang kemahe sowang-sowangan.","Lalu mereka mengambil mayat Absalom dan melemparkannya ke dalam lobang yang besar di hutan itu, kemudian mereka mendirikan di atasnya timbunan batu yang sangat besar. Dan seluruh orang Israel melarikan diri, masing-masing ke kemahnya."
506,2 Samuel 18,18,"Nalika isih sugeng Pangeran Absalom wis ngadegake tugu kagem sarirane piyambak, kang tumeka saiki isih ana ing lebak Ratu, awit pangandikane: “Aku ora duwe anak lanang, kang nglestarekake pangeling-eling marang jenengku.” Lan tugu iku dijenengake manut asmane piyambak, mulane tugu iku nganti saprene diarani: tugu pangeling-elinge marang Pangeran Absalom.","Sewaktu hidupnya Absalom telah mendirikan bagi dirinya sendiri tugu yang sekarang ada di Lembah Raja, sebab katanya: ""Aku tidak ada anak laki-laki untuk melanjutkan ingatan kepada namaku."" Dan ia telah menamai tugu itu menurut namanya sendiri; sebab itu sampai hari ini tugu itu dinamai orang: tugu peringatan Absalom."
507,2 Samuel 18,0,Pawarta bab sedane Pangeran Absalom diaturake marang Prabu Dawud,Kabar kematian Absalom disampaikan kepada Daud
508,2 Samuel 18,19,"Ahimaas bin Zadhok banjur matur: “Kawula mugi kalilana mlajeng ngunjuki pawartos ingkang sae punika dhateng Sang Prabu, bilih Sang Yehuwah sampun paring adil dhateng Sang Prabu, inggih punika kaluwaran saking tanganing mengsahipun.”","Kemudian berkatalah Ahimaas bin Zadok: ""Biarlah aku berlari menyampaikan kabar yang baik itu kepada raja, bahwa TUHAN telah memberi keadilan kepadanya dengan melepaskan dia dari tangan musuhnya."""
509,2 Samuel 18,20,"Nanging Senapati Yoab ngandika: “Ing dina iki aja kowe kang nggawa pawarta, mung dina liyane kowe sing nggawa pawarta, mung ing dina iki kowe aja ngunjukake pawarta, manawa putrane Sang Prabu seda.”","Tetapi berkatalah Yoab kepadanya: ""Pada hari ini bukan engkau yang menjadi pembawa kabar, pada hari lain boleh engkau yang menyampaikan kabar, tetapi pada hari ini engkau tidak akan menyampaikan kabar karena anak raja sudah mati."""
510,2 Samuel 18,21,"Senapati Yoab banjur ngandika marang sawijining wong Etiopia: “Lungaa, ngaturna uninga marang Sang Prabu, apa kang wis kokdeleng.” Wong Etiopia iku sujud nyembah marang Senapati Yoab, banjur mangkat kanthi lumayu.","Lalu berkatalah Yoab kepada seorang Etiopia: ""Pergilah, beritahukanlah kepada raja apa yang kaulihat."" Orang Etiopia itu sujud menyembah kepada Yoab, lalu berlari pergi."
511,2 Samuel 18,22,"Ahimaas bin Zadhok banjur matur marang Senapati Yoab: “Punapa kemawon ingkang badhe kelampahan, kula inggih kalilana mangkat mlajeng, nusul tiyang Etiopia punika.” Nanging Senapati Yoab ngandika: “Yagene kowe kok kadereng arep mangkat, ngger? Apa kowe nggawa pawarta kang ana pituwase?”","Tetapi berkatalah sekali lagi Ahimaas bin Zadok kepada Yoab: ""Apapun yang terjadi, izinkanlah juga aku berlari pergi menyusul orang Etiopia itu."" Tetapi kata Yoab: ""Mengapa juga engkau mau berlari pergi, anakku? Apakah engkau membawa kabar yang menguntungkanmu?"""
512,2 Samuel 18,23,"Wangsulane: “Punapa kemawon ingkang badhe kelampahan, kula badhe mlajeng mangkat.” Yoab banjur ngandika: “Yen mangkono iya wis mlayua!” Ahimaas banjur lumayu metu dalan kang saka Lebak Yarden, temah tekane ndhisiki wong Etiopia iku.","Jawabnya: ""Apapun yang terjadi, aku mau berlari pergi."" Lalu berkatalah Yoab kepadanya: ""Kalau demikian larilah."" Maka berlarilah Ahimaas mengambil jalan dari Lembah Yordan, sehingga ia mendahului orang Etiopia itu."
513,2 Samuel 18,24,"Kacarita Sang Prabu Dawud lagi lenggah ana ing antarane gapura loro, dene prajurit jaga munggah ing payone gapura iku, ana ing ndhuwur balowarti. Nalika prajurit iku ngawasake, ndeleng wong teka mlayu-mlayu ijen bae,","Adapun Daud duduk di antara kedua pintu gerbang sedang penjaga naik ke sotoh pintu gerbang itu, di atas tembok. Ketika ia melayangkan pandangnya, dilihatnyalah orang datang berlari, seorang diri saja."
514,2 Samuel 18,25,"nuli nguwuh-uwuh, ngaturi uninga marang Sang Prabu, banjur dipangandikani: “Yen tekane ijen bae, mesthi nggawa pawarta becik.” Nalika wong mau sangsaya nyedhak,","Berserulah penjaga memberitahu raja, lalu raja berkata: ""Jika ia seorang diri, maka kabar yang baiklah disampaikannya."" Sementara orang itu mendekat,"
515,2 Samuel 18,26,"prajurit iku weruh wong liyane, banjur nguwuh-uwuh aweh weruh marang kang jaga gapura: “Lah punika wonten tiyang malih ingkang mlajeng piyambakan kemawon.” Sang Prabu banjur ngandika: “Iku mesthi nggawa pawarta becik.”","penjaga itu melihat seorang lain datang berlari, lalu penjaga itu menyerukan kepada penunggu pintu gerbang, katanya: ""Lihat, ada lagi orang datang berlari, seorang diri."" Berkatalah raja: ""Itupun pembawa kabar yang baik."""
516,2 Samuel 18,27,"Sawuse iku pecalang munjuk: “Tiyang ingkang dhateng rumiyin punika caranipun mlajeng kados caranipun Ahimaas bin Zadhok.” Pangandikane Sang Prabu: “Iku wong becik, tekane mesthi nggawa pawarta becik.”","Sesudah itu berkatalah penjaga: ""Aku lihat cara berlari orang yang pertama itu seperti cara berlari Ahimaas bin Zadok."" Berkatalah raja: ""Itu orang baik, ia datang membawa kabar yang baik."""
517,2 Samuel 18,28,"Ahimaas banjur nguwuh-uwuh, unjuke marang Sang Prabu: “Sugeng!” Banjur sujud nyembah marang Sang Prabu, raine konjem ing bumi sarta munjuk: “Pinujia Sang Yehuwah, Gusti Allah dalem ingkang sampun masrahaken para tiyang ingkang sami ngagagaken tanganipun dhumateng gusti kawula Sang Prabu.”","Lalu Ahimaas berseru, katanya kepada raja: ""Selamat!"" Kemudian sujudlah ia menyembah kepada raja dengan mukanya ke tanah serta berkata: ""Terpujilah TUHAN, Allahmu, yang telah menyerahkan orang-orang yang menggerakkan tangannya melawan tuanku raja."""
518,2 Samuel 18,29,"Sang Prabu banjur ndangu: “Absalom, bocah anom iku apa slamet?” Atur wangsulane Ahimaas: “Kala wau kawula ningali kawontenan ingkang rame sanget, nalika Sang Yoab ndhawuhi kawula mangkat sowan dhateng ngarsa dalem, nanging abdi dalem boten mangretos punika punapa.”","Lalu bertanyalah raja: ""Selamatkah Absalom, orang muda itu?"" Jawab Ahimaas: ""Aku melihat keributan yang besar, ketika Yoab menyuruh pergi hamba raja, hambamu ini, tetapi aku tidak tahu apa itu."""
519,2 Samuel 18,30,"Sang Prabu banjur ngandika: “Sumingkira menyang ing sandhingingsun, ngadega ing kene.” Banjur sumingkir nisih lan ngadeg terus.","Kemudian berkatalah raja: ""Pergilah ke samping, berdirilah di sini."" Ia pergi ke samping dan tinggal berdiri."
520,2 Samuel 18,31,"Wong Etiopia teka, banjur munjuk mengkene: “Dhuh gusti kawula Sang Prabu, angsal pawartos sae, amargi Sang Yehuwah sampun paring adil dhateng panjenengan dalem ing dinten punika, dene sampun ngluwari gusti kawula saking tanganipun sadaya tiyang ingkang nglawan dhateng gusti kawula.”","Maka datanglah orang Etiopia itu. Kata orang Etiopia itu: ""Tuanku raja mendapat kabar yang baik, sebab TUHAN telah memberi keadilan kepadamu pada hari ini dengan melepaskan tuanku dari tangan semua orang yang bangkit menentang tuanku."""
521,2 Samuel 18,32,Nanging Sang Prabu ndangu marang wong Etiopia iku: “Absalom wong anom iku apa slamet?” Atur wangsulane wong Etiopia iku: “Mugi mengsahipun gusti kawula Sang Prabu sami dadosa kados sang anem punika saha sakathahipun tiyang ingkang sami nglawan dhateng gusti kawula sumedya tumindak awon.”,"Tetapi bertanyalah raja kepada orang Etiopia itu: ""Selamatkah Absalom, orang muda itu?"" Jawab orang Etiopia itu: ""Biarlah seperti orang muda itu musuh tuanku raja dan semua orang yang bangkit menentang tuanku untuk berbuat jahat."""
522,2 Samuel 18,0,Sang Prabu Dawud nandhang prihatos,Kesedihan Daud
523,2 Samuel 18,33,"Sang Prabu temah kaget lan sungkawa banget, nuli minggah menyang lotenging gapura, sarta banjur muwun. Sajrone tindak pangandikane mangkene: “Adhuh anakku engger Absalom, ngger, anakku Absalom! Bok luwung aku bae kang mati dadia lirumu. Adhuh Absalom, anakku, anakku!”","Maka terkejutlah raja dan dengan sedih ia naik ke anjung pintu gerbang lalu menangis. Dan beginilah perkataannya sambil berjalan: ""Anakku Absalom, anakku, anakku Absalom! Ah, kalau aku mati menggantikan engkau, Absalom, anakku, anakku!"""
524,2 Samuel 20,0,Pambalelane Seba,Pemberontakan Seba
525,2 Samuel 20,1,"Nalika semana ing kono pinuju ana wong dursila, jenenge Seba bin Bikri, wong Benyamin, iku ngunekake kalasangka sarta ngucap: “Kita ora duwe panduman saka Dawud. Kita ora duwe warisan tumrap anake Isai. He wong Israel, payo padha mulih menyang kemah kita dhewe-dhewe!”","Kebetulan ada di sana seorang dursila, bernama Seba bin Bikri, orang Benyamin. Ia meniup sangkakala serta berkata: ""Kita tidak memperoleh bagian dari pada Daud. Kita tidak memperoleh warisan dari anak Isai itu. Masing-masing ke kemahnya, hai orang Israel!"""
526,2 Samuel 20,2,"Sakehe wong Israel banjur padha ninggal Prabu Dawud lan ngetutburi Seba bin Bikri, dene wong Yehuda tetep setya marang ratune, padha ndherekake tindake wiwit saka bengawan Yarden nganti tekan ing Yerusalem.","Lalu semua orang Israel itu meninggalkan Daud dan mengikuti Seba bin Bikri, sedangkan orang-orang Yehuda tetap berpaut kepada raja mereka, mengikutinya dari sungai Yordan sampai Yerusalem."
527,2 Samuel 20,3,"Sarawuhe Sang Prabu Dawud ing Yerusalem, banjur nimbali garwa ampeyan sepuluh, kang ditilar ngreksa kraton, nuli dilebetake ing sawijining omah tutupan; Sang Prabu ngingoni para wong wadon iku nanging ora dirawuhi. Padha dikebonake kaya randha nganti sapatine.","Sampailah Daud ke istananya di Yerusalem, lalu raja mengambil kesepuluh gundik yang ditinggalkannya untuk menunggui istana, kemudian dimasukkannya mereka dalam sebuah rumah di bawah penjagaan. Ia memelihara mereka, tetapi tidak dihampirinya. Mereka tetap terasing seperti janda sampai hari mati mereka."
528,2 Samuel 20,4,"Sang Prabu Dawud ngandika marang Sang Amasa: “Para wong Yehuda kerigna sajrone telung dina, sawise sowana mrene maneh!”","Berkatalah raja kepada Amasa: ""Kerahkanlah bagiku orang-orang Yehuda dalam tiga hari, kemudian menghadaplah lagi ke mari!"""
529,2 Samuel 20,5,"Sang Amasa banjur mangkat ngumpulake wong Yehuda, nanging kuwajibane diendhe-endhe nganti kliwat wektune kang katemtokake dening Sang Prabu.","Lalu pergilah Amasa mengerahkan orang Yehuda, tetapi ia menunda-nunda tugas itu sampai melewati waktu yang ditetapkan raja baginya."
530,2 Samuel 20,6,"Sang Prabu Dawud banjur ngandika marang Sang Abisai: “Ing wektu iki Seba bin Bikri iku tumrap kita luwih mbebayani katimbang karo Absalom, mulane sira bae ngirida balane gustinira, lan wong iku burunen aja nganti mlebu ing kutha beteng temahan mrucut saka ing tangan kita.”","Lalu berkatalah Daud kepada Abisai: ""Sekarang Seba bin Bikri lebih berbahaya bagi kita dari pada Absalom; jadi engkau, bawalah orang-orang tuanmu ini dan kejarlah dia, supaya jangan ia mencapai kota yang berkubu, dan dengan demikian ia luput dari pada kita."""
531,2 Samuel 20,7,"Sang Yoab, wong Kreti, wong Pleti lan sakehe para prawira padha budhal nututi. Padha metu Yerusalem nedya ngoyak Seba bin Bikri.","Lalu Yoab, orang Kreti dan orang Pleti dan semua pahlawan keluar menyusul dia. Mereka keluar dari Yerusalem untuk mengejar Seba bin Bikri."
532,2 Samuel 20,8,"Bareng tekan ing sacedhake watu gedhe ing Gibeon, Sang Amasa wus ndhisiki ana ing kono. Dene Sang Yoab asikep praboting perang sarta sabukan, kalawan nyengkelit pedhang ing bangkekane. Nalika jumangkah maju, pedhange konus lan runtuh.","Ketika mereka sampai ke batu besar yang di Gibeon, maka Amasa sudah tiba di sana lebih dahulu dari pada mereka. Adapun Yoab mengenakan pakaian perang dan di luarnya ada ikat pinggang dengan pedang bersarung terpaut pada pinggangnya. Ketika ia tampil ke muka terjatuhlah pedang itu."
533,2 Samuel 20,9,"Sang Yoab ngandika marang Sang Amasa: “Sampeyan wilujeng, sadherek!” sarta nyekel janggute klawan tangane tengen jenggote Sang Amasa arep ngaras.","Berkatalah Yoab kepada Amasa: ""Engkau baik-baik, saudaraku?"" Sementara itu tangan kanan Yoab memegang janggut Amasa untuk mencium dia."
534,2 Samuel 20,10,"Sang Amasa ora nglegewa mungguh pedhange kang ana astane Sang Yoab, Sang Yoab nyudukake pedhang iku ing padharane, temah jerohane wutah ing bumi. Anggone nyuduk ora susah mindho, amarga wis tumeka ing pati. Sang Yoab karo Sang Abisai sadhereke terus ngoyak Seba bin Bikri.","Amasa tidak awas terhadap pedang yang ada di tangan Yoab itu; Yoab menikam pedang itu ke perutnya, sehingga isi perutnya tertumpah ke tanah. Tidak usah dia ditikamnya dua kali, sebab ia sudah mati. Lalu Yoab dan Abisai, adiknya, terus mengejar Seba bin Bikri."
535,2 Samuel 20,11,"Lan ana sawijining balane Sang Yoab ngadeg sacedhake mayit iku sarta ngucap: “Sapa kang rumaket marang Sang Yoab lan milih Sang Prabu Dawud, enggal nututana Sang Yoab.”","Dan seorang dari orang-orang Yoab tinggal berdiri di dekat mayat itu, sambil berkata: ""Siapa yang suka kepada Yoab dan siapa yang memihak kepada Daud, baiklah mengikuti Yoab!"""
536,2 Samuel 20,12,"Ing wektu iku Sang Amasa gumlethak akuthah getih ana ing tengah dalan gedhe. Bareng wong iku weruh, yen sakehing wong padha nonton, mayite Amasa banjur disingkirake saka ing dalan gedhe menyang ing ara-ara, dilurubi jubah, amarga weruh, yen saben wong kang teka mrono padha mandheg nonton.","Dalam pada itu Amasa terguling mati dalam darahnya di tengah-tengah jalan raya. Ketika orang itu melihat, bahwa seluruh rakyat berdiri menonton, maka disingkirkannya mayat Amasa dari jalan raya ke padang, lalu dihamparkannya kain di atasnya, karena dilihatnya, bahwa setiap orang yang datang ke sana berdiri menonton."
537,2 Samuel 20,13,"Sawuse mayite disingkirake saka ing dalan gedhe, wong kabeh padha mlaku terus ngetutake Sang Yoab ngoyak-oyak Seba bin Bikri.","Setelah dijauhkannya mayat itu dari jalan raya, maka semua orang itu berjalan terus mengikuti Yoab untuk mengejar Seba bin Bikri."
538,2 Samuel 20,14,Seba wus ngliwati dhaerahe sakehe taler Israel ngener menyang Abel-Bet-Maakha. Lan kabeh balane wong Bikri wus nglumpuk lan ngetutake dheweke.,Seba telah melintasi daerah semua suku Israel menuju Abel-Bet-Maakha. Dan semua orang Bikri telah berkumpul dan mengikuti dia.
539,2 Samuel 20,15,"Nanging balane Sang Yoab wus tekan ing kono lan banjur ngepung dheweke ana ing Abel-Bet-Maakha, nuli padha ngundhug-undhug lemah kanggo tameng ing ngarepe kutha, nganti mepet tekan ing balowarti njaba, dene sakehe wong kang ndherek Sang Yoab padha njugangi balowartine kutha iku murih jugruge.","Tetapi sampailah orang-orang Yoab, lalu mengepung dia di Abel-Bet-Maakha; mereka menimbun tanah menjadi tembok terhadap kota ini dan tembok ini merapat sampai ke tembok luar sedang seluruh rakyat yang bersama-sama dengan Yoab menggali tembok kota itu untuk meruntuhkannya."
540,2 Samuel 20,16,"Banjur ana sawijining wong wadon saka ing kutha kono kang limpad ing budi, kang nguwuh-uwuh: “Ngrungokna ta! Ngrungokna ta! Matura marang Sang Yoab: Kula aturi nyelak mriki, supados kula saged matur dhateng panjenengan.”","Lalu berserulah seorang perempuan bijaksana dari kota itu: ""Dengar! Dengar! Katakanlah kepada Yoab: Mendekatlah ke mari, supaya aku berbicara dengan engkau."""
541,2 Samuel 20,17,Sang Yoab nuli nyedhaki wong wadon mau. Wong wadon mau banjur matur pitakon: “Punapa panjenengan Sang Yoab?” Wangsulane: “Iya aku iki Yoab.” Wong wadon mau banjur matur: “Mugi miyarsakna aturipun ingkang abdi.” Wangsulane: “Iya.”,"Maka mendekatlah Yoab kepada perempuan itu. Bertanyalah perempuan itu: ""Engkaukah Yoab?"" Jawabnya: ""Benar!"" Lalu berkatalah perempuan itu kepadanya: ""Dengarkanlah perkataan hambamu ini!"" Jawabnya: ""Baik!"""
542,2 Samuel 20,18,Wong wadon iku nuli matur: “Kala rumiyin kalimrah tiyang wicanten makaten: Becike wong neneges ana ing Abel lan ing Dhan: punapa punika sampun kasuwak punapa ingkang sampun katetepaken dening tiyang-tiyang ingkang setya ing Israel?,"Kemudian berkatalah perempuan itu: ""Dahulu biasa orang berkata begini: Baiklah orang minta petunjuk di Abel dan di Dan, apakah sudah dihapuskan"
543,2 Samuel 20,19,"Nanging panjenengan punika kok badhe ngrisak satunggaling kitha, mangka punika kitha babon ing Israel. Kenging punapa panjenengan kok badhe ngrisak tanah pusakanipun Sang Yehuwah?”","apa yang telah ditetapkan oleh orang-orang yang setia di Israel! Tetapi engkau ini berikhtiar membinasakan suatu kota, apalagi suatu kota induk di Israel. Mengapa engkau hendak menelan habis milik pusaka TUHAN?"""
544,2 Samuel 20,20,Sang Yoab banjur mangsuli: “Muga aku kaedohna saka ing pangarah ngrebut lan ngrusak!,"Lalu Yoab menjawab: ""Jauhlah, jauhlah dari padaku untuk menelan dan memusnahkan!"
545,2 Samuel 20,21,"Nalare ora mangkono. Nanging ana sawijining wong kang aran Seba bin Bikri kang wus ngangkat tangane mbalela marang Sang Prabu Dawud. Ulungna wong siji iku marang tanganku, aku bakal mundur saka ing kutha kene.” Wong wadon mau banjur matur marang Sang Yoab: “Prayogi, sirahipun badhe kula uncalaken wonten ing ngarsa panjenengan saking ing sawingkinging balowarti punika.”","Bukanlah begitu halnya. Tetapi seorang dari pegunungan Efraim, yang bernama Seba bin Bikri, telah menggerakkan tangannya melawan raja Daud; serahkanlah dia seorang diri, maka aku akan undur dari kota ini."" Lalu berkatalah perempuan itu kepada Yoab: ""Baik, kepalanya akan dilemparkan kepadamu dari belakang tembok ini."""
546,2 Samuel 20,22,"Wong wadon iku banjur mlebu rembugan karo wong sakutha kabeh kanthi kawicaksanan. Sawuse iku wong ing kutha kono banjur padha nigas sirahe Seba bin Bikri lan diuncalake marang Sang Yoab. Sang Yoab banjur ngungelake kalasangka, sabalane kabeh padha bubar ninggal kutha iku, mulih menyang padunungane sowang-sowangan. Sang Yoab banjur bali menyang Yerusalem seba marang ing ngarsane Sang Prabu Dawud.","Kemudian masuklah pula perempuan itu dan berbicara kepada seluruh rakyat dengan bijaksana; sesudah itu mereka memenggal kepala Seba bin Bikri dan melemparkannya kepada Yoab. Yoab meniup sangkakala, lalu berserak-seraklah mereka meninggalkan kota itu, masing-masing ke tempatnya. Maka pulanglah Yoab ke Yerusalem kepada raja."
547,2 Samuel 20,0,Para punggawane Sang Prabu Dawud,Pegawai-pegawai Daud
548,2 Samuel 20,23,"Anadene Sang Yoab didadekake Senapatine sakehing wadyabala Israel, lan Sang Benaya bin Yoyadha dadi tetindhihe wong Kreti lan wong Pleti.","Yoab menjadi kepala atas segenap tentara Israel, dan Benaya bin Yoyada menjadi kepala atas orang Kreti dan orang Pleti."
549,2 Samuel 20,24,"Sang Adoram dadi wadanane wong nyangga karya, lan Yosafat bin Ahilud dadi kang rumeksa bandha,",Adoram menjadi kepala orang rodi dan Yosafat bin Ahilud menjadi bendahara negara.
550,2 Samuel 20,25,Sang Seya dadi panitra-nagara; Sang Zadhok lan Sang Abyatar jumeneng imam.,Seya menjadi panitera negara; Zadok dan Abyatar menjadi imam.
