,bab,ayat,jawa,indo
1177,Mazmur 74,2,"Paduka mugi karsaa ngengeti umat Paduka ingkang sampun Paduka pundhut wiwit kala kina, ingkang Paduka tebus dados bangsa kagungan Paduka piyambak, saha mugi karsaa ngengeti dhateng redi Sion kadhaton Paduka!","Ingatlah akan umat-Mu yang telah Kauperoleh pada zaman purbakala, yang Kautebus menjadi bangsa milik-Mu sendiri! Ingatlah akan gunung Sion yang Engkau diami."
1178,Mazmur 74,3,Paduka mugi karsaa rawuh ing panggenan ingkang kalajeng-lajeng risak punika; sadaya-sadayanipun sampun kasirnakaken dening mengsah wonten ing pasucen.,Ringankanlah langkah-Mu ke tempat yang rusak terus-menerus; segala-galanya telah dimusnahkan musuh di tempat kudus.
1179,Mazmur 74,4,"Satru Paduka sami mbaung wonten ing dalem pamujan Paduka, saha sampun ngedegaken benderanipun kadamel tetenger.",Lawan-lawan-Mu mengaum di tempat pertemuan-Mu dan telah mendirikan panji-panji mereka sebagai tanda.
1180,Mazmur 74,5,"Katingalipun kados tiyang ingkang ninggil wadung ngantos inggil, kaempakaken ing kekajengan ingkang ketel,","Kelihatannya seperti orang mengayunkan tinggi-tinggi sebuah kapak kepada kayu-kayuan yang lebat,"
1181,Mazmur 74,6,lan sapunika ukir-ukiranipun sami dipun dhawahi ing kampak tuwin wadung sadaya;,dan sekarang ukir-ukirannya seluruhnya dipalu mereka dengan kapak dan beliung;
1182,Mazmur 74,7,"padaleman Paduka ingkang suci dipun besmi, sarta papan padalemaning asma Paduka dipun najisaken ngantos dumugi ing siti;","mereka menyulut tempat kudus-Mu dengan api, mereka menajiskan tempat kediaman nama-Mu sampai pada tanah;"
1183,Mazmur 74,8,osiking manahipun makaten: “Apike padha daktumpes kabeh wae!” Lajeng dalem pamujan ing saindenging nagari dipun besmeni sadaya.,"mereka berkata dalam hatinya: ""Baiklah kita menindas mereka semuanya!"" Mereka membakar segala tempat pertemuan Allah di negeri."
1184,Mazmur 74,9,"Tetenger kawula boten wonten ingkang katingal, nabi inggih sampun boten wonten malih, saha panunggilan kawula sadaya boten wonten ingkang sumerep badhe ngantos sapinten dangunipun malih.","Tanda-tanda kami tidak kami lihat, tidak ada lagi nabi, dan tidak ada di antara kami yang mengetahui berapa lama lagi."
1185,Mazmur 74,10,"Dhuh Allah badhe ngantos sapinten dangunipun anggenipun satru punika nyenyampahi, saha mengsah anggenipun ngawon-awon asma Paduka tanpa kendel punika?","Berapa lama lagi, ya Allah, lawan itu mencela, dan musuh menista nama-Mu terus-menerus?"
1186,Mazmur 74,11,"Punapaa dene Paduka narik wangsul asta Paduka, sarta numpangaken asta Paduka ingkang tengen ing jaja?","Mengapa Engkau menarik kembali tangan-Mu, menaruh tangan kanan-Mu di dada?"
1187,Mazmur 74,12,"Ewasamanten Paduka, dhuh Allah, dados Ratu kawula wiwit jaman kina mila, ingkang paring pangluwaran wonten ing bumi.","Namun Engkau, ya Allah adalah Rajaku dari zaman purbakala, yang melakukan penyelamatan di atas bumi."
1188,Mazmur 74,13,"Inggih Paduka punika ingkang miyak saganten klayan kakiyatan Paduka, ingkang ngremuki endhasipun naga-naga wonten ing sanginggiling toya.","Engkaulah yang membelah laut dengan kekuatan-Mu, yang memecahkan kepala ular-ular naga di atas muka air."
1189,Mazmur 74,14,"Paduka ingkang ngremuki endhasipun Lewiyatan-lewiyatan, Paduka pakakaken dhateng sato ing pasamunan.","Engkaulah yang meremukkan kepala-kepala Lewiatan, yang memberikannya menjadi makanan penghuni-penghuni padang belantara."
1190,Mazmur 74,15,Paduka ingkang mbelah sumber saha lepen; Paduka ingkang ngesataken lepen-lepen ingkang ajeg mili.,Engkaulah yang membelah mata air dan sungai; Engkaulah yang mengeringkan sungai-sungai yang selalu mengalir.
1191,Mazmur 74,16,"Rinten punika kagungan Paduka, dalu punika ugi kagungan Paduka, Paduka ingkang mrenahaken pepadhang saha surya.","Punya-Mulah siang, punya-Mulah juga malam. Engkaulah yang menaruh benda penerang dan matahari."
1192,Mazmur 74,17,"Paduka ingkang netepaken watesipun bumi sadaya, mangsa ketiga kaliyan mangsa rendheng Paduka ingkang ngawontenaken.","Engkaulah yang menetapkan segala batas bumi, musim kemarau dan musim hujan Engkaulah yang membuat-Nya."
1193,Mazmur 74,18,"Paduka mugi karsaa ngengeti punika: mengsah memada, dhuh Yehuwah, bangsa ingkang keblinger punika ngawon-awon asma Paduka.","Ingatlah ini: musuh mencela, ya TUHAN, dan bangsa yang bebal itu menista nama-Mu."
1194,Mazmur 74,19,"Nyawanipun peksi dara Paduka sampun ngantos Paduka pakakaken dhateng sato galak; Paduka mugi sampun ngantos kelajeng-lajeng kesupen dhateng nyawanipun para tiyang kagungan Paduka, ingkang katindhes!",Janganlah berikan nyawa merpati-Mu kepada binatang liar! Janganlah lupakan terus-menerus nyawa orang-orang-Mu yang tertindas!
1195,Mazmur 74,20,"Paduka mugi enget dhateng prajanjian Paduka, amargi papan-papan ingkang peteng ing bumi punika kebak susuh panganiaya.","Pandanglah kepada perjanjian, sebab tempat-tempat gelap di bumi penuh sarang-sarang kekerasan."
1196,Mazmur 74,21,Tiyang ingkang siniya-siya sampun ngantos wangsul kanthi wirang. Tiyang ingkang kasangsaran sarta tiyang ingkang mlarat supados sami ngalembana dhateng asma Paduka.,Janganlah biarkan orang yang terinjak-injak kembali dengan kena noda. Biarlah orang sengsara dan orang miskin memuji-muji nama-Mu.
1197,Mazmur 74,22,"Dhuh Allah, Paduka mugi karsaa jumeneng sarta nindakaken pangadilan Paduka! Mugi karsaa enget dhumateng panacadipun para tiyang ingkang kablinger dhumateng Paduka sadinten muput punika.","Bangunlah, ya Allah, lakukanlah perjuangan-Mu! Ingatlah akan cela kepada-Mu dari pihak orang bebal sepanjang hari."
1198,Mazmur 74,23,"Paduka mugi sampun ngantos kesupen dhateng swaranipun satru Paduka, saha bengok-bengokipun tiyang ingkang sami mbalela dhumateng Paduka, ingkang tanpa kendel, malah sangsaya sora punika.","Janganlah lupa suara lawan-Mu, deru orang-orang yang bangkit melawan Engkau, yang terus-menerus makin keras."
1199,Mazmur 75,0,"MASMUR 75; Gusti Allah, Hakim kang adil","Allah, Hakim yang adil"
1200,Mazmur 75,1,"Kanggo lurah pasindhen. Miturut lagu: Aja ngrusak. Masmur anggitane Asaf. Kekidungan. (75-2) Kawula sami ngunjukaken pamuji sokur dhumateng Paduka, dhuh Allah, kawula sami ngunjukaken pamuji sokur, tiyang-tiyang ingkang nyebut asma Paduka sami nyariyosaken pakaryan Paduka ingkang ngedab-edabi.","Untuk pemimpin biduan. Menurut lagu: Jangan memusnahkan. Mazmur Asaf. Nyanyian. (75-2) Kami bersyukur kepada-Mu, ya Allah, kami bersyukur, dan orang-orang yang menyerukan nama-Mu menceritakan perbuatan-perbuatan-Mu yang ajaib."
1201,Mazmur 75,2,"(75-3) “Manawa Ingsun nemtokake wektune, Ingsun piyambak kang bakal mancasi kalawan adil.","(75-3) ""Apabila Aku menetapkan waktunya, Aku sendiri akan menghakimi dengan kebenaran."
1202,Mazmur 75,3,"(75-4) Bumi lan sakehing wong saisine padha lebur; Ingsun, iya Ingsun piyambak kang njejegake cagak-cagake.” (Selah)","(75-4) Bumi hancur dan semua penduduknya; tetapi Akulah yang mengokohkan tiang-tiangnya."" Sela"
1203,Mazmur 75,4,(75-5) Ingsun ngandika marang para wong gumunggung: “Sira aja padha gumunggung.” Sarta marang para wong duraka: “Sira aja padha masang sungu!,"(75-5) Aku berkata kepada pembual-pembual: ""Jangan membual."" Dan kepada orang-orang fasik: ""Jangan meninggikan tanduk!"
1204,Mazmur 75,5,"(75-6) Aja padha masang sungunira nganti dhuwur, lan aja calathu kalawan ndegeg!”","(75-6) Jangan mengangkat tandukmu tinggi-tinggi, jangan berbicara dengan bertegang leher!"""
1205,Mazmur 75,6,"(75-7) Sabab kamulyan iku pinangkane ora saka ing wetan utawa saka ing kulon, lan iya ora saka ing pasamunan,","(75-7) Sebab bukan dari timur atau dari barat dan bukan dari padang gurun datangnya peninggian itu,"
1206,Mazmur 75,7,"(75-8) nanging Gusti Allah iku kang jumeneng Hakim: nglorod wong kang siji, sarta njunjung sijine.",(75-8) tetapi Allah adalah Hakim: direndahkan-Nya yang satu dan ditinggikan-Nya yang lain.
1207,Mazmur 75,8,"(75-9) Astane Pangeran nyepeng tuwung isi anggur kang munthuk, kebak campuran bumbu; Panjenengane banjur ngiling saka ing kono; lah ampase bakal disruput lan diombe dening sakehing wong duraka ing bumi.","(75-9) Sebab sebuah piala ada di tangan TUHAN, berisi anggur berbuih, penuh campuran bumbu; Ia menuang dari situ; sungguh, ampasnya akan dihirup dan diminum oleh semua orang fasik di bumi."
1208,Mazmur 75,9,"(75-10) Nanging aku bakal surak-surak ing salawas-lawase, Gusti Allahe Rama Yakub bakal dakpuji kalawan masmur.","(75-10) Tetapi aku hendak bersorak-sorak untuk selama-lamanya, aku hendak bermazmur bagi Allah Yakub."
1209,Mazmur 75,10,"(75-11) Sakehing sungune para wong duraka bakal diremuk, nanging sungune wong mursid iku bakal padha didhuwurake.","(75-11) Segala tanduk orang-orang fasik akan dihancurkan-Nya, tetapi tanduk-tanduk orang benar akan ditinggikan."
1210,Mazmur 76,0,"MASMUR 76; Gusti Allah, Hakime para bangsa","Allah, Hakim segala bangsa"
1211,Mazmur 76,1,"Kanggo lurah pasindhen. Binarung ing swaraning clempung. Masmur anggitane Asaf. Kekidungan. (76-2) Gusti Allah iku kesuwur ana ing Yahuda, asmane kondhang ana ing Israel!","Untuk pemimpin biduan. Dengan permainan kecapi. Mazmur Asaf. Nyanyian. (76-2) Allah terkenal di Yehuda, nama-Nya masyhur di Israel!"
1212,Mazmur 76,2,"(76-3) Kemahe wus ana ing Salem, sarta padalemane ana ing Sion!","(76-3) Di Salem sudah ada pondok-Nya, dan kediaman-Nya di Sion!"
1213,Mazmur 76,3,"(76-4) Ana ing kono Pangeran wus mutungi panah kang kumilat, tameng tuwin pedhang sarta piranti perang. (Selah)","(76-4) Di sanalah dipatahkan-Nya panah yang berkilat, perisai dan pedang dan alat perang. Sela"
1214,Mazmur 76,4,(76-5) Gumilaping cahya Paduka punika kamulyanipun ngungkuli pareden ingkang wonten wiwit kina makina.,"(76-5) Cemerlang Engkau, lebih mulia dari pada pegunungan yang ada sejak purba."
1215,Mazmur 76,5,"(76-6) Para wong kendel wus padha kajarah-rayah, padha ngantuk angles, para prawira kabeh wus padha kaya koncatan ing kakuwatane.","(76-6) Orang-orang yang berani telah dijarah, mereka terlelap dalam tidurnya, dan semua orang yang gagah perkasa kehilangan kekuatannya."
1216,Mazmur 76,6,"(76-7) Dhuh Allahipun Rama Yakub, amargi saking bebendu Paduka, kapal saha ingkang numpaki sami katileman.","(76-7) Oleh sebab hardik-Mu, ya Allah Yakub, tertidur lelap baik pengendara maupun kuda."
1217,Mazmur 76,7,(76-8) Paduka punika nggegirisi! Sinten ingkang tahan wonten ing ngarsa Paduka samangsa Paduka duka?,(76-8) Dahsyat Engkau! Siapakah yang tahan berdiri di hadapan-Mu pada saat Engkau murka?
1218,Mazmur 76,8,"(76-9) Paduka ndhawahaken pancasaning pangadilan saking ing langit; bumi ajrih saha kami-tenggengen,","(76-9) Dari langit Engkau memperdengarkan keputusan-Mu; bumi takut dan tertegun,"
1219,Mazmur 76,9,"(76-10) nalika Gusti Allah jumeneng ngasta pangadilan, saha ngluwari sakathahipun tiyang ingkang katindhes wonten ing bumi. (Selah)","(76-10) pada waktu Allah bangkit untuk memberi penghukuman, untuk menyelamatkan semua yang tertindas di bumi. Sela"
1220,Mazmur 76,10,"(76-11) Saestu para tiyang brangasan lajeng badhe sami caos sokur dhumateng asma Paduka, kekantunaning tiyang brangasan sami Paduka kendhaleni.","(76-11) Sesungguhnya panas hati manusia akan menjadi syukur bagi-Mu, dan sisa panas hati itu akan Kauperikatpinggangkan."
1221,Mazmur 76,11,"(76-12) Padha ngucapna nadar banjur padha luwarana konjuk ing Yehuwah Allahmu! Kabeh wong kang ana ing ngarsane Yehuwah, kareben padha ngunjukake pisungsung marang Panjenengane kang diwedeni.","(76-12) Bernazarlah dan bayarlah nazarmu itu kepada TUHAN, Allahmu! Biarlah semua orang yang di sekeliling-Nya menyampaikan persembahan kepada Dia yang ditakuti,"
1222,Mazmur 76,12,"(76-13) Panjenengane kang nglemesake semangate para pemimpin, Panjenengane kang nggegirisi tumrap para ratu ing bumi.","(76-13) Dia yang mematahkan semangat para pemimpin, Dia yang dahsyat bagi raja-raja di bumi."
1223,Mazmur 77,0,MASMUR 77; Pakaryane Gusti Allah kang wus kapungkur,Perbuatan Allah di masa lampau
1224,Mazmur 77,1,"Kanggo lurah pasindhen. Miturut: Yedutun. Masmur anggitane Asaf. (77-2) Aku arep nyebut marang Gusti Allah kalawan swara sora, kalawan swara sora marang Gusti Allah, supaya midhangetake marang aku.","Untuk pemimpin biduan. Menurut: Yedutun. Mazmur Asaf. (77-2) Aku mau berseru-seru dengan nyaring kepada Allah, dengan nyaring kepada Allah, supaya Ia mendengarkan aku."
1225,Mazmur 77,2,"(77-3) Ing dina karubedan aku ngupaya Pangeran; ing wayah bengi tanganku dakegarake, lan ora banjur kesel, nyawaku lumuh diarih-arih.","(77-3) Pada hari kesusahanku aku mencari Tuhan; malam-malam tanganku terulur dan tidak menjadi lesu, jiwaku enggan dihiburkan."
1226,Mazmur 77,3,"(77-4) Manawa aku ngangen-angen marang Allah, banjur ngadhuh-adhuh, manawa dakrasak-rasakake, nyawaku saya lungkrah lesu. (Selah)","(77-4) Apabila aku mengingat Allah, maka aku mengerang, apabila aku merenung, makin lemah lesulah semangatku. Sela"
1227,Mazmur 77,4,"(77-5) Paduka damel mripat kawula tansah kelop-kelop; kawula semplah, temah boten saged wicanten.","(77-5) Engkau membuat mataku tetap terbuka; aku gelisah, sehingga tidak dapat berkata-kata."
1228,Mazmur 77,5,(77-6) Kawula manah-manah dhateng lelampahan nalika jaman kina; kawula kengetan taun-taun ingkang sampun kapengker.,"(77-6) Aku memikir-mikir hari-hari zaman purbakala, tahun-tahun zaman dahulu aku ingat."
1229,Mazmur 77,6,"(77-7) Ing wanci dalu kawula ngenam-enam salebeting manah, kawula nggagas-nggagas tuwin nyawa kawula nlusur-nlusur:","(77-7) Aku sebut-sebut pada waktu malam dalam hatiku, aku merenung, dan rohku mencari-cari:"
1230,Mazmur 77,7,"(77-8) “Pangeran apa iya nampik ing salawase, lan apa ora bakal paring sih-piwelas maneh?","(77-8) ""Untuk selamanyakah Tuhan menolak dan tidak kembali bermurah hati lagi?"
1231,Mazmur 77,8,"(77-9) Sih-susetyane apa wus sirna ing sabanjure, prasetyane apa wus tumeka ing pungkasane nganti turun-tumurun?","(77-9) Sudah lenyapkah untuk seterusnya kasih setia-Nya, telah berakhirkah janji itu berlaku turun-temurun?"
1232,Mazmur 77,9,"(77-10) Gusti Allah apa wus kesupen marang ing pangemane, sih-piwelase apa kapunggel marga saka bebendune?” (Selah)","(77-10) Sudah lupakah Allah menaruh kasihan, atau ditutup-Nyakah rahmat-Nya karena murka-Nya?"" Sela"
1233,Mazmur 77,10,"(77-11) Ing kono pangucapku: “Iki kang nuwek atiku, dene astane tengen Kang Mahaluhur wis owah!”","(77-11) Maka kataku: ""Inilah yang menikam hatiku, bahwa tangan kanan Yang Mahatinggi berubah."""
1234,Mazmur 77,11,"(77-12) Aku bakal ngeling-eling pakaryan-pakaryane Pangeran Yehuwah, inggih, kawula badhe ngengeti kaelokan Paduka kala jaman kina.","(77-12) Aku hendak mengingat perbuatan-perbuatan TUHAN, ya, aku hendak mengingat keajaiban-keajaiban-Mu dari zaman purbakala."
1235,Mazmur 77,12,"(77-13) Kawula badhe nyebut sakathahing pakaryan Paduka, sarta badhe manah dhateng saliring pandamel Paduka.","(77-13) Aku hendak menyebut-nyebut segala pekerjaan-Mu, dan merenungkan perbuatan-perbuatan-Mu."
1236,Mazmur 77,13,"(77-14) Dhuh Allah, margi Paduka punika suci! Allah ingkang pundi ingkang agung kados Allah kawula sadaya?","(77-14) Ya Allah, jalan-Mu adalah kudus! Allah manakah yang begitu besar seperti Allah kami?"
1237,Mazmur 77,14,(77-15) Paduka punika Gusti Allah ingkang nindakaken kaelokan; Paduka sampun nglairaken pangwaos Paduka wonten ing tengahipun para bangsa.,(77-15) Engkaulah Allah yang melakukan keajaiban; Engkau telah menyatakan kuasa-Mu di antara bangsa-bangsa.
1238,Mazmur 77,15,"(77-16) Umat Paduka, tedhak turunipun Rama Yakub tuwin Rama Yusuf, sampun Paduka tebus klayan asta Paduka. (Selah)","(77-16) Dengan lengan-Mu Engkau telah menebus umat-Mu, bani Yakub dan bani Yusuf. Sela"
1239,Mazmur 77,16,"(77-17) Dhuh Allah, toya-toya sampun sami ningali Paduka, toya-toya sampun sami ningali Paduka saha sami gumeter, malah samodra agung inggih ndhredheg.","(77-17) Air telah melihat Engkau, ya Allah, air telah melihat Engkau, lalu menjadi gentar, bahkan samudera raya gemetar."
1240,Mazmur 77,17,"(77-18) Mendhung nggrojogaken toya, gumuruh swaraning mega mawarni-warni, malah jemparing Paduka sami pating clorot.","(77-18) Awan-awan mencurahkan air, awan-gemawan bergemuruh, bahkan anak-anak panah-Mu beterbangan."
1241,Mazmur 77,18,"(77-19) Swaraning gludhug Paduka gumledheg, kilat-kilat sami madhangi jagad, bumi geter saha gonjang-ganjing.","(77-19) Deru guntur-Mu menggelinding, kilat-kilat menerangi dunia, bumi gemetar dan bergoncang."
1242,Mazmur 77,19,"(77-20) Margi Paduka nglangkungi saganten, sarta lurung Paduka nglangkungi nginggiling toya ingkang wiyar, nanging tapak tilas Paduka boten katingal.","(77-20) Melalui laut jalan-Mu dan lorong-Mu melalui muka air yang luas, tetapi jejak-Mu tidak kelihatan."
1243,Mazmur 77,20,"(77-21) Paduka sampun ngirid umat Paduka kados nggiring menda apanthan, lumantar Nabi Musa lan Imam Harun.",(77-21) Engkau telah menuntun umat-Mu seperti kawanan domba dengan perantaraan Musa dan Harun.
1244,Mazmur 78,0,MASMUR 78; Piwulanging sejarah,Pelajaran dari sejarah
1245,Mazmur 78,1,"Kidung piwulang anggitane Asaf. Dhuh bangsaku, piwulangku padha rungokna, pamicarane cangkemku padha tilingna.","Nyanyian pengajaran Asaf. Pasanglah telinga untuk pengajaranku, hai bangsaku, sendengkanlah telingamu kepada ucapan mulutku."
1246,Mazmur 78,2,"Aku arep mbukak cangkemku prelu medharake bebasan, aku arep ngucapake cangkriman jaman kuna,","Aku mau membuka mulut mengatakan amsal, aku mau mengucapkan teka-teki dari zaman purbakala."
1247,Mazmur 78,3,"Apa kang wus padha kita rungu, sarta kita sumurupi, lan kang dicritakake dening para leluhur kita marang kita,","Yang telah kami dengar dan kami ketahui, dan yang diceritakan kepada kami oleh nenek moyang kami,"
1248,Mazmur 78,4,"ora bakal daksidhem tumrap anak-putune; nanging kita bakal nyaritakake marang para turun ing tembe pepujian marang Pangeran Yehuwah lan kasantosane, sarta kaelokan-kaelokan kang wus katindakake.","kami tidak hendak sembunyikan kepada anak-anak mereka, tetapi kami akan ceritakan kepada angkatan yang kemudian puji-pujian kepada TUHAN dan kekuatan-Nya dan perbuatan-perbuatan ajaib yang telah dilakukan-Nya."
1249,Mazmur 78,5,"Pangeran wus ndhawuhake pepenget marang trahe Rama Yakub, lan angger-anggering Toret marang Banisrael; para leluhur kita padha kadhawuhan ngluntakake iku marang para anak putune,","Telah ditetapkan-Nya peringatan di Yakub dan hukum Taurat diberi-Nya di Israel; nenek moyang kita diperintahkan-Nya untuk memperkenalkannya kepada anak-anak mereka,"
1250,Mazmur 78,6,"supaya disumurupana dening para turune ing sapungkure, supaya anak-putu kang ing tembe bakal padha lair, padha gumregah lan nyaritakake marang anak-anake,","supaya dikenal oleh angkatan yang kemudian, supaya anak-anak, yang akan lahir kelak, bangun dan menceritakannya kepada anak-anak mereka,"
1251,Mazmur 78,7,"supaya padha kumandela marang Gusti Allah, lan aja lali marang sakabehing pakaryane, nanging padha netepana dhawuh-dhawuhe;","supaya mereka menaruh kepercayaan kepada Allah dan tidak melupakan perbuatan-perbuatan Allah, tetapi memegang perintah-perintah-Nya;"
1252,Mazmur 78,8,"apadene aja padha kaya para leluhure, kang padha wangkot lan mbalela, jenis kang ora antepan tuwin kang nyawane ora setya marang Gusti Allah.","dan jangan seperti nenek moyang mereka, angkatan pendurhaka dan pemberontak, angkatan yang tidak tetap hatinya dan tidak setia jiwanya kepada Allah."
1253,Mazmur 78,9,"Bani Efraim, prajurit panahan kang sikep gegaman ganep, padha mundur nalika dinane perang.","Bani Efraim, pemanah-pemanah yang bersenjata lengkap, berbalik pada hari pertempuran;"
1254,Mazmur 78,10,Padha ora nggondheli prasetyaning Allah sarta padha emoh lumaku manut ing Torete.,mereka tidak berpegang pada perjanjian Allah dan enggan hidup menurut Taurat-Nya.
1255,Mazmur 78,11,"Padha lali marang pakaryane lan kaelokan kang katindakake, kang wus dikatingalake marang dheweke kabeh.","Mereka melupakan pekerjaan-pekerjaan-Nya dan perbuatan-perbuatan-Nya yang ajaib, yang telah diperlihatkan-Nya kepada mereka."
1256,Mazmur 78,12,"Gusti Allah wus nindakake kaelokan-kaelokan ana ing ngarepe para leluhure, ana ing tanah Mesir, ana ing ara-ara Zoan;","Di hadapan nenek moyang mereka dilakukan-Nya keajaiban-keajaiban, di tanah Mesir, di padang Zoan;"
1257,Mazmur 78,13,"segara dipiyak, para leluhur padha disabrangake; banyune diadegake kaya bendungan,","dibelah-Nya laut, diseberangkan-Nya mereka; didirikan-Nya air sebagai bendungan,"
1258,Mazmur 78,14,"ing wayah awan lakune para umat dituntun kalawan mega, ing wayah bengi kalawan padhanging geni.","dituntun-Nya mereka dengan awan pada waktu siang, dan semalam suntuk dengan terang api;"
1259,Mazmur 78,15,"Gunung parang ing ara-ara samun dibengkah, para leluhur mau tumuli padha diparingi banyu akeh kaya saka ing samodra agung;","dibelah-Nya gunung batu di padang gurun, diberi-Nya mereka minum banyak air seperti dari samudera raya;"
1260,Mazmur 78,16,"saka ing parang Gusti Allah mijilake kali, grojoging banyune kaya bengawan.","dibuat-Nya aliran air keluar dari bukit batu, dan dibuat-Nya air turun seperti sungai."
1261,Mazmur 78,17,"Ewadene para leluhur mau ndlarung anggone gawe dosa marang Panjenengane, yaiku anggone mbalela marang Kang Mahaluhur ana ing pasamunan.","Tetapi mereka terus berbuat dosa terhadap Dia, dengan memberontak terhadap Yang Mahatinggi di padang kering."
1262,Mazmur 78,18,Malah padha nyoba marang Gusti Allah ing sajroning atine yaiku anggone nyuwun pangan kanggo nguja hawa-napsune.,Mereka mencobai Allah dalam hati mereka dengan meminta makanan menuruti nafsu mereka.
1263,Mazmur 78,19,Padha rasanan bab Gusti Allah mangkene: “Allah apa iya kuwasa nyedhiyani pangan ana ing ara-ara samun?,"Mereka berkata terhadap Allah: ""Sanggupkah Allah menyajikan hidangan di padang gurun?"
1264,Mazmur 78,20,"Pancen Panjenengane nggebag parang satemah metu banyune lan banjur ana kali-kali kang mili; nanging apa iya kuwaos paring roti, utawa nyawisi daging para umate?”","Memang, Ia memukul gunung batu, sehingga terpancar air dan membanjir sungai-sungai; tetapi sanggupkah Ia memberikan roti juga, atau menyediakan daging bagi umat-Nya?"""
1265,Mazmur 78,21,"Iku kapiyarsa dening Pangeran Yehuwah, njalari dukane, temahan ana geni kang mubal nempuh bani Yakub, sarta bebendune nempuh Banisrael,","Sebab itu, ketika mendengar hal itu, TUHAN gemas, api menyala menimpa Yakub, bahkan murka bergejolak menimpa Israel,"
1266,Mazmur 78,22,"awit padha ora pracaya marang Gusti Allah, sarta ora padha kumandel marang pitulungane.","sebab mereka tidak percaya kepada Allah, dan tidak yakin akan keselamatan dari pada-Nya."
1267,Mazmur 78,23,"Gusti Allah tumuli dhawuh marang mega-mega ing dhuwur, lan mbikak lawang-lawanging langit,","Maka Ia memerintahkan awan-awan dari atas, membuka pintu-pintu langit,"
1268,Mazmur 78,24,"umate diudani mana minangka pangane, sarta padha diparingi gandum saka ing langit;","menurunkan kepada mereka hujan manna untuk dimakan, dan memberikan kepada mereka gandum dari langit;"
1269,Mazmur 78,25,saben wong wus mangan roti malaekat; padha dikirimi sangu pangan nganti turah-turah.,"setiap orang telah makan roti malaikat, Ia mengirimkan perbekalan kepada mereka berlimpah-limpah."
1270,Mazmur 78,26,Pangeran ngididake angin wetan ana ing awang-awang lan nggiring angin kidul kalawan kakiyatane;,Ia telah menghembuskan angin timur di langit dan menggiring angin selatan dengan kekuatan-Nya;
1271,Mazmur 78,27,"umate banjur diudani daging kehe kaya bledug, tuwin diudani manuk kang mawa swiwi cacahe kaya wedhining segara;","Ia menurunkan kepada mereka hujan daging seperti debu banyaknya, dan hujan burung-burung bersayap seperti pasir laut;"
1272,Mazmur 78,28,"padha katibakake ing satengahing tarub-tarube, ing sakubenging papan panggonane mau.","Ia menjatuhkannya ke tengah perkemahan mereka, sekeliling tempat kediaman itu."
1273,Mazmur 78,29,Tumuli padha mangan nganti wareg banget; Panjenengane maringi apa kang padha dikarepake.,Mereka makan dan menjadi sangat kenyang; Ia memberikan kepada mereka apa yang mereka inginkan.
1274,Mazmur 78,30,"Nalika isih padha rumangsa durung wareg, sarta pangane isih ana ing cangkeme;","Mereka belum merasa puas, sedang makanan masih ada di mulut mereka;"
1275,Mazmur 78,31,"Gusti Allah banjur duka marang wong-wong iku, gembong-gembonge padha dipateni, lan para nonomane Israel padha disirnakake.","maka bangkitlah murka Allah terhadap mereka: Ia membunuh gembong-gembong mereka, dan menewaskan teruna-teruna Israel."
1276,Mazmur 78,32,"Sanadyan mangkono, para leluhur mau iya isih bae anggone padha nglakoni dosa, sarta ora pracaya marang sakehing pakaryane Allah kang ngedab-edabi.",Sekalipun demikian mereka masih saja berbuat dosa dan tidak percaya kepada perbuatan-perbuatan-Nya yang ajaib.
1277,Mazmur 78,33,"Mulane dina-dinane kadamel sirna tanpa tanja, sarta taun-taune padha sirna sajroning pagiris.","Sebab itu Ia membuat hari-hari mereka habis dalam kesia-siaan, dan tahun-tahun mereka dalam kekejutan."
1278,Mazmur 78,34,"Bareng padha dipateni banjur padha nakokake marang Panjenengane, padha mratobat sarta padha ngupaya marang Gusti Allah;","Apabila Ia membunuh mereka, maka mereka mencari Dia, mereka berbalik dan mengingini Allah;"
1279,Mazmur 78,35,"padha kelingan, yen Gusti Allah iku peparange, lan Gusti Allah Kang Mahaluhur iku dadi Juru Panebuse.","mereka teringat bahwa Allah adalah gunung batu mereka, dan bahwa Allah Yang Mahatinggi adalah Penebus mereka."
1280,Mazmur 78,36,Nanging padha ngapusi Panjenengane kalawan cangkeme lan nggorohi Panjenengane kalawan ilate.,"Tetapi mereka memperdaya Dia dengan mulut mereka, dan dengan lidahnya mereka membohongi Dia."
1281,Mazmur 78,37,"Atine ora mantep marang Panjenengane, lan ora setya marang ing prajanjiane.","Hati mereka tidak tetap pada Dia, dan mereka tidak setia pada perjanjian-Nya."
