,bab,ayat,jawa,indo
601,Mazmur 38,14,"(38-15) Malah kados tiyang ingkang boten mireng, lan cangkemipun boten saged mabeni.","(38-15) ya, aku ini seperti orang yang tidak mendengar, yang tak ada bantahan dalam mulutnya."
602,Mazmur 38,15,"(38-16) Dene Paduka ingkang kawula ajeng-ajeng, dhuh Yehuwah; Paduka ingkang badhe maringi wangsulan, dhuh Pangeran Allah kawula.","(38-16) Sebab kepada-Mu, ya TUHAN, aku berharap; Engkaulah yang akan menjawab, ya Tuhan, Allahku."
603,Mazmur 38,16,"(38-17) Gagasan kawula makaten: “Anggeripun tiyang punika sampun ngantos bingah-bingah margi saking kawula, sampun ngantos gumunggung manawi suku kawula gloyoran!”","(38-17) Pikirku: ""Asal mereka jangan beria-ria karena aku, jangan membesarkan diri terhadap aku apabila kakiku goyah!"""
604,Mazmur 38,17,"(38-18) Awit kawula badhe dhawah jalaran kasandhung, saha kawula tansah karidhu ing sakit.","(38-18) Sebab aku mulai jatuh karena tersandung, dan aku selalu dirundung kesakitan;"
605,Mazmur 38,18,"(38-19) Dene kawula ngakeni kalepatan kawula, kawula melang-melang margi saking dosa kawula.","(38-19) ya, aku mengaku kesalahanku, aku cemas karena dosaku."
606,Mazmur 38,19,"(38-20) Mengsah kawula kathah sanget, tuwin kathah tiyang ingkang sengit dhumateng kawula tanpa sabab;","(38-20) Orang-orang yang memusuhi aku besar jumlahnya, banyaklah orang-orang yang membenci aku tanpa sebab;"
607,Mazmur 38,20,"(38-21) tiyang ingkang males awon dhateng kasaenan kawula, sami nglawan kawula, amargi kawula ngudi dhateng kasaenan.","(38-21) mereka membalas yang jahat kepadaku ganti yang baik, mereka memusuhi aku, karena aku mengejar yang baik."
608,Mazmur 38,21,"(38-22) Dhuh Yehuwah Allah kawula, Paduka mugi sampun negakaken kawula, sampun nebihi kawula.","(38-22) Jangan tinggalkan aku, ya TUHAN, Allahku, janganlah jauh dari padaku!"
609,Mazmur 38,22,"(38-23) Mugi enggala mitulungi kawula, dhuh Pangeran, Pamarta kawula!","(38-23) Segeralah menolong aku, ya Tuhan, keselamatanku!"
610,Mazmur 39,0,MASMUR 39; Pandonga nyuwun pitulungan,Doa minta tolong
611,Mazmur 39,1,"Kanggo lurah pasindhen, kanggo Yedutun. Masmur anggitane Prabu Dawud. (39-2) Gagasanku mangkene: “Aku dak ngati-ati, supaya aku aja nganti nglakoni dosa kalawan ilatku, cangkemku dakjaga kalawan dakbrangus, sajrone wong duraka isih ana ing ngarepku.”","Untuk pemimpin biduan. Untuk Yedutun. Mazmur Daud. (39-2) Pikirku: ""Aku hendak menjaga diri, supaya jangan aku berdosa dengan lidahku; aku hendak menahan mulutku dengan kekang selama orang fasik masih ada di depanku."""
612,Mazmur 39,2,"(39-3) Aku mbisu, aku meneng, aku mbisu, aku adoh karo bab kang becik, nanging prihatinku saya banget.","(39-3) Aku kelu, aku diam, aku membisu, aku jauh dari hal yang baik; tetapi penderitaanku makin berat."
613,Mazmur 39,3,"(39-4) Atiku panas ana ing jeroku, murub kaya geni nalika aku sesambat; aku munjuk kalawan ilatku:","(39-4) Hatiku bergejolak dalam diriku, menyala seperti api, ketika aku berkeluh kesah; aku berbicara dengan lidahku:"
614,Mazmur 39,4,"(39-5) “Dhuh Yehuwah, Paduka mugi karsaa paring sumerep bab ngajal kawula, punapadene bab watesing umur kawula, supados kawula mangretos bilih kawula punika boten langgeng!","(39-5) ""Ya TUHAN, beritahukanlah kepadaku ajalku, dan apa batas umurku, supaya aku mengetahui betapa fananya aku!"
615,Mazmur 39,5,"(39-6) Lah dangunipun umur kawula punika sampun Paduka temtokaken namung sawatawis tebah; saha gesang kawula punika kados barang ingkang kothong wonten ing ngarsa Paduka, pancen saben tiyang punika namung satunggaling bab ingkang tanpa gina. (Selah)","(39-6) Sungguh, hanya beberapa telempap saja Kautentukan umurku; bagi-Mu hidupku seperti sesuatu yang hampa. Ya, setiap manusia hanyalah kesia-siaan! Sela"
616,Mazmur 39,6,"(39-7) Manungsa punika namung kadosdene wewayangan ingkang langkung, namung usreg kemawon bab barang ingkang tanpa paedah, nandho-nandho nanging boten sumerep sinten ingkang badhe ngrakup.","(39-7) Ia hanyalah bayangan yang berlalu! Ia hanya mempeributkan yang sia-sia dan menimbun, tetapi tidak tahu, siapa yang meraupnya nanti."
617,Mazmur 39,7,"(39-8) Dados sapunika ingkang kula ajeng-ajeng punika punapa, dhuh Gusti? Namung Paduka kemawon ingkang kawula ajab.","(39-8) Dan sekarang, apakah yang kunanti-nantikan, ya Tuhan? Kepada-Mulah aku berharap."
618,Mazmur 39,8,"(39-9) Paduka mugi karsaa ngluwari kawula saking sakathahing kalepatan, kawula sampun ngantos dados cecampahanipun tiyang gemblung.","(39-9) Lepaskanlah aku dari segala pelanggaranku, jangan jadikan aku celaan orang bebal!"
619,Mazmur 39,9,"(39-10) Kawula mingkem, boten mbikak cangkem kawula, amargi Paduka piyambak ingkang tumindak.","(39-10) Aku kelu, tidak kubuka mulutku, sebab Engkau sendirilah yang bertindak."
620,Mazmur 39,10,"(39-11) Paduka mugi karsaa nyingkiraken panyiksa Paduka saking kawula, kawula remuk-rempu margi saking panggebag Paduka.","(39-11) Hindarkanlah aku dari pada pukulan-Mu, aku remuk karena serangan tangan-Mu."
621,Mazmur 39,11,"(39-12) Paduka ngrangket tiyang mawi paukuman, jalaran lepat; kaendahanipun Paduka lebur kadosdene renget, pancen saben tiyang punika namung bab ingkang tanpa gina. (Selah)","(39-12) Engkau menghajar seseorang dengan hukuman karena kesalahannya, dan menghancurkan keelokannya sama seperti gegat; sesungguhnya, setiap manusia adalah kesia-siaan belaka. Sela"
622,Mazmur 39,12,"(39-13) Dhuh Yehuwah mugi karsaa miyarsakaken pandonga kawula, saha nilingna ing pasambat kawula, tetesing eluh kawula sampun Paduka kendelaken kemawon, amargi kawula punika mondhok wonten ing ngarsa Paduka, tiyang neneka kadosdene leluhur kawula sadaya.","(39-13) Dengarkanlah doaku, ya TUHAN, dan berilah telinga kepada teriakku minta tolong, janganlah berdiam diri melihat air mataku! Sebab aku menumpang pada-Mu, aku pendatang seperti semua nenek moyangku."
623,Mazmur 39,13,"(39-14) Paduka mugi mengkeraken kawula, supados kawula saged bingar, saderengipun kawula kesah sarta boten wonten ing malih.”","(39-14) Alihkanlah pandangan-Mu dari padaku, supaya aku bersukacita sebelum aku pergi dan tidak ada lagi!"""
624,Mazmur 40,0,MASMUR 40; Panuwun lan pandonga,Syukur dan doa
625,Mazmur 40,1,"Kanggo lurah pasindhen. Masmur anggitane Prabu Dawud. (40-2) Aku nganti-anti banget marang Sang Yehuwah, nuli iya diuningani, sarta pasambatku dipiyarsakake.",Untuk pemimpin biduan. Mazmur Daud. (40-2) Aku sangat menanti-nantikan TUHAN; lalu Ia menjenguk kepadaku dan mendengar teriakku minta tolong.
626,Mazmur 40,2,"(40-3) Aku dientasake saka luwenging bilai, lan saka ing bladhering rawa, sikilku banjur didegake ana ing parang, jangkahku dikukuhake.","(40-3) Ia mengangkat aku dari lobang kebinasaan, dari lumpur rawa; Ia menempatkan kakiku di atas bukit batu, menetapkan langkahku,"
627,Mazmur 40,3,"(40-4) Apadene cangkemku diparingi kidung anyar, kidung pamuji marang Allah kita, akeh wong kang padha weruh, temahan wedi, lan banjur kumandel marang Pangeran Yehuwah.","(40-4) Ia memberikan nyanyian baru dalam mulutku untuk memuji Allah kita. Banyak orang akan melihatnya dan menjadi takut, lalu percaya kepada TUHAN."
628,Mazmur 40,4,"(40-5) Rahayu wong, kang padha kumandel marang Pangeran Yehuwah, kang ora tumolih marang wong kang padha kumlungkung, lan marang wong kang nyimpang marang ing pambekan cidra.","(40-5) Berbahagialah orang, yang menaruh kepercayaannya pada TUHAN, yang tidak berpaling kepada orang-orang yang angkuh, atau kepada orang-orang yang telah menyimpang kepada kebohongan!"
629,Mazmur 40,5,"(40-6) Dhuh Yehuwah Allah kawula, sampun kathah ingkang Paduka tindakaken, pakaryan Paduka ingkang elok saha karsa Paduka tumrap kawula sadaya, boten wonten ingkang saged kajejeraken kaliyan Paduka. Kaelokan Paduka badhe kawula cariyosaken saha kawula ucapaken, nanging manawi kaetang kakathahen sanget cacahipun.","(40-6) Banyaklah yang telah Kaulakukan, ya TUHAN, Allahku, perbuatan-Mu yang ajaib dan maksud-Mu untuk kami. Tidak ada yang dapat disejajarkan dengan Engkau! Aku mau memberitakan dan mengatakannya, tetapi terlalu besar jumlahnya untuk dihitung."
630,Mazmur 40,6,"(40-7) Paduka boten karenan dhateng kurban sembelehan saha kurban dhaharan. Paduka sampun mbikak kuping kawula, Paduka boten mundhut kurban obaran tuwin kurban pangruwating dosa.","(40-7) Engkau tidak berkenan kepada korban sembelihan dan korban sajian, tetapi Engkau telah membuka telingaku; korban bakaran dan korban penghapus dosa tidak Engkau tuntut."
631,Mazmur 40,7,(40-8) Kula lajeng munjuk: “Lah punika kawula sowan; ing gulunganing kitab sampun wonten seratipun ingkang magepokan kaliyan kawula;,"(40-8) Lalu aku berkata: ""Sungguh, aku datang; dalam gulungan kitab ada tertulis tentang aku;"
632,Mazmur 40,8,"(40-9) dhuh Allah kawula, kawula remen nglampahi karsa Paduka; sarta angger-angger Paduka wonten ing batos kawula.”","(40-9) aku suka melakukan kehendak-Mu, ya Allahku; Taurat-Mu ada dalam dadaku."""
633,Mazmur 40,9,"(40-10) Kawula martosaken kaleresan wonten ing pasamuwanipun tiyang kathah; malah kawula boten mekak lambe kawula, dhuh Yehuwah, Paduka ingkang ugi mirsa.","(40-10) Aku mengabarkan keadilan dalam jemaah yang besar; bahkan tidak kutahan bibirku, Engkau juga yang tahu, ya TUHAN."
634,Mazmur 40,10,"(40-11) Kaadilan boten kawula sidhem wonten ing manah kawula, kasetyan Paduka saha kawilujengan ingkang saking Paduka kawula rembag, katresnan saha kaleresan Paduka boten kawula sidhem wonten ing pasamuwanipun tiyang kathah.","(40-11) Keadilan tidaklah kusembunyikan dalam hatiku, kesetiaan-Mu dan keselamatan dari pada-Mu kubicarakan, kasih-Mu dan kebenaran-Mu tidak kudiamkan kepada jemaah yang besar."
635,Mazmur 40,11,"(40-12) Dhuh Yehuwah, Paduka mugi sampun ngantos mekak sih-kadarman Paduka saking kawula, kawula mugi tansah kareksaa ing katresnan saha kaleresan Paduka!","(40-12) Engkau, TUHAN, janganlah menahan rahmat-Mu dari padaku, kasih-Mu dan kebenaran-Mu kiranya menjaga aku selalu!"
636,Mazmur 40,12,"(40-13) Amargi bebaya ngepang kawula ngantos boten kenging kaetang kathahipun. Kawula sampun ketututan ing duraka kawula, ngantos kawula boten tahan ningali; cacahipun nglangkungi cacahipun rambutipun sirah kawula, temah manah kawula pasrah.","(40-13) Sebab malapetaka mengepung aku sampai tidak terbilang banyaknya. Aku telah terkejar oleh kesalahanku, sehingga aku tidak sanggup melihat; lebih besar jumlahnya dari rambut di kepalaku, sehingga hatiku menyerah."
637,Mazmur 40,13,"(40-14) Dhuh Yehuwah, Paduka mugi karsaa ngluwari kawula; dhuh Yehuwah, mugi enggal karsaa paring pitulungan dhumateng kawula!","(40-14) Berkenanlah kiranya Engkau, ya TUHAN, untuk melepaskan aku; TUHAN, segeralah menolong aku!"
638,Mazmur 40,14,"(40-15) Sadaya tiyang ingkang ngangkah dhateng nyawa kawula, mugi sami nandhanga wirang tuwin isin; ingkang ngudi bilai kawula, mugi sami mundur sarta nandhanga wirang!",(40-15) Biarlah mendapat malu dan tersipu-sipu mereka semua yang ingin mencabut nyawaku; biarlah mundur dan kena noda mereka yang mengingini kecelakaanku!
639,Mazmur 40,15,"(40-16) Tiyang ingkang mungel: “Sokur, sokur!” dhateng kawula, punika mugi kabungkema cangkemipun margi wirang.","(40-16) Biarlah terdiam karena malu mereka yang mengatai aku: ""Syukur, syukur!"""
640,Mazmur 40,16,"(40-17) Tiyang ingkang ngupadosi Paduka, mugi sami bingah-bingah sarta suka-suka margi saking Paduka; ingkang remen dhateng kawilujengan ingkang saking Paduka, tetepa ngucap makaten: “Pangeran Yehuwah, linuhurna!”","(40-17) Biarlah bergembira dan bersukacita karena Engkau semua orang yang mencari Engkau; biarlah mereka yang mencintai keselamatan dari pada-Mu tetap berkata: ""TUHAN itu besar!"""
641,Mazmur 40,17,"(40-18) Kawula punika sangsara lan mlarat, nanging Pangeran nggalih dhateng kawula, Paduka ingkang mitulungi tuwin ngluwari kawula, dhuh Allah kawula, mugi sampun ngantos rendhet!","(40-18) Aku ini sengsara dan miskin, tetapi Tuhan memperhatikan aku. Engkaulah yang menolong aku dan meluputkan aku, ya Allahku, janganlah berlambat!"
642,Mazmur 41,0,MASMUR 41; Pandonga nyuwun kawarasan,Doa minta penyembuhan
643,Mazmur 41,1,Kanggo lurah pasindhen. Masmur anggitane Prabu Dawud. (41-2) Rahayu wong kang nggatekake marang wong kang ringkih! Wong iku bakal dipitulungi Sang Yehuwah ing wektu nandhang sangsara.,Untuk pemimpin biduan. Mazmur Daud. (41-2) Berbahagialah orang yang memperhatikan orang lemah! TUHAN akan meluputkan dia pada waktu celaka.
644,Mazmur 41,2,"(41-3) Pangeran Yehuwah bakal ngayomi lan ngopeni nyawane, temah kasebut wong begja ana ing bumi; Paduka boten badhe marengaken piyambakipun dipun angge dolanan dening mengsahipun!","(41-3) TUHAN akan melindungi dia dan memelihara nyawanya, sehingga ia disebut berbahagia di bumi; Engkau takkan membiarkan dia dipermainkan musuhnya!"
645,Mazmur 41,3,"(41-4) Manawa kecandhak ing lelara, dibiyantu dening Sang Yehuwah ana ing paturone, Paduka sarasaken babar pisan sesakitipun wonten ing patilemanipun.",(41-4) TUHAN membantu dia di ranjangnya waktu sakit; di tempat tidurnya Kaupulihkannya sama sekali dari sakitnya.
646,Mazmur 41,4,"(41-5) Mungguh aku, aturku mangkene: “Dhuh Yehuwah kawula mugi Paduka welasi, kawula mugi Paduka sarasaken, amargi anggen kawula damel dosa punika dhumateng Paduka.”","(41-5) Kalau aku, kataku: ""TUHAN, kasihanilah aku, sembuhkanlah aku, sebab terhadap Engkaulah aku berdosa!"""
647,Mazmur 41,5,"(41-6) Satruku padha nyatur aku ala: “Besuk kapan matine wong iku, sarta sirnane jenenge?”","(41-6) Musuhku mengatakan yang jahat tentang aku: ""Bilakah ia mati, dan namanya hilang lenyap?"""
648,Mazmur 41,6,"(41-7) Wong kang tilik aku, rembuge goroh: atine kebak piala, bareng metu iku diwartak-wartakake.","(41-7) Orang yang datang menjenguk, berkata dusta; hatinya penuh kejahatan, lalu ia keluar menceritakannya di jalan."
649,Mazmur 41,7,"(41-8) Sakehing wong kang sengit marang aku padha bisik-bisik bab aku, padha ngrantam piala marang aku:","(41-8) Semua orang yang benci kepadaku berbisik-bisik bersama-sama tentang aku, mereka merancangkan yang jahat terhadap aku:"
650,Mazmur 41,8,"(41-9) “Wong iku wis kecandhak ing lelara kang mbebayani, anggone ngleleh ora bakal bisa tangi maneh.”","(41-9) ""Penyakit jahanam telah menimpa dia, sekali ia berbaring, takkan bangun-bangun lagi."""
651,Mazmur 41,9,"(41-10) Dalah mitraku kang dakpracaya, kang kembul mangan karo aku, iku uga ngethungake tungkake marang aku.","(41-10) Bahkan sahabat karibku yang kupercayai, yang makan rotiku, telah mengangkat tumitnya terhadap aku."
652,Mazmur 41,10,"(41-11) Nanging Paduka dhuh Yehuwah, mugi karsaa melasi kawula saha njejegaken kawula, kawula lajeng badhe males dhateng tiyang-tiyang punika.","(41-11) Tetapi Engkau, ya TUHAN, kasihanilah aku dan tegakkanlah aku, maka aku hendak mengadakan pembalasan terhadap mereka."
653,Mazmur 41,11,"(41-12) Margi saking makaten kawula sumerep, bilih Paduka karenan dhumateng kawula, punika manawi kawula boten dados margining satru kawula lajeng asurak-surak.","(41-12) Dengan demikian aku tahu, bahwa Engkau berkenan kepadaku, apabila musuhku tidak bersorak-sorai karena aku."
654,Mazmur 41,12,"(41-13) Wondene menggah ing kawula, Paduka ngekahaken kawula margi saking temen kawula, sarta Paduka jejegaken wonten ing ngarsa Paduka ing salami-laminipun.","(41-13) Tetapi aku, Engkau menopang aku karena ketulusanku, Engkau membuat aku tegak di hadapan-Mu untuk selama-lamanya."
655,Mazmur 41,13,"(41-14) Pinujia Pangeran Yehuwah, Allahe Israel, wiwit ing kalanggengan tumeka ing kalanggengan! Amin, Amin.","(41-14) Terpujilah TUHAN, Allah Israel, dari selama-lamanya sampai selama-lamanya! Amin, ya amin."
656,Mazmur 42,0,Jilid II: MASMUR 42--72; Kangen marang Gusti Allah,Kerinduan kepada Allah
657,Mazmur 42,1,"Kanggo lurah pasindhen. Kidung piwulang anggitane bani Korakh. (42-2) Kados pangorongipun sangsam dhateng toyaning lepen, inggih makaten kangening nyawa kawula dhumateng Paduka, dhuh Allah.","Untuk pemimpin biduan. Nyanyian pengajaran bani Korah. (42-2) Seperti rusa yang merindukan sungai yang berair, demikianlah jiwaku merindukan Engkau, ya Allah."
658,Mazmur 42,2,"(42-3) Nyawaku ngorong marang Allah, marang Allah kang gesang, besuk kapan anggonku diparengake sowan ndeleng Gusti Allah?","(42-3) Jiwaku haus kepada Allah, kepada Allah yang hidup. Bilakah aku boleh datang melihat Allah?"
659,Mazmur 42,3,(42-4) Luhku kang dakpangan rina lan wengi awit sadina muput aku dicalathoni ing wong mangkene: “Allahmu ana ing ngendi?”,"(42-4) Air mataku menjadi makananku siang dan malam, karena sepanjang hari orang berkata kepadaku: ""Di mana Allahmu?"""
660,Mazmur 42,4,"(42-5) Iki bakal dakeling-eling, sajrone nyawaku sedhih lan lesu: sarehne wonge akeh banget kapriye bisaku maju ndhisiki wong-wong iku menyang ing padalemaning Allah kalawan surak-surak lan ngrepekake kidung panuwun, ana ing karameaning wong-wong kang padha nganakake pahargyan.","(42-5) Inilah yang hendak kuingat, sementara jiwaku gundah-gulana; bagaimana aku berjalan maju dalam kepadatan manusia, mendahului mereka melangkah ke rumah Allah dengan suara sorak-sorai dan nyanyian syukur, dalam keramaian orang-orang yang mengadakan perayaan."
661,Mazmur 42,5,"(42-6) Dhuh nyawaku, yagene kok tumungkul, lan ngolang-ngaling ana ing jeroku? Ngarep-arepa marang Allah, awit Panjenengane bakal dakpuji, Panjenengane kang dadi Pitulunganku lan Allahku!","(42-6) Mengapa engkau tertekan, hai jiwaku, dan gelisah di dalam diriku? Berharaplah kepada Allah! Sebab aku akan bersyukur lagi kepada-Nya, penolongku dan Allahku!"
662,Mazmur 42,6,"(42-7) Nyawa kawula tumungkul wonten ing nglebet kawula, mila kawula lajeng kengetan dhumateng Paduka, saking ing pasitening benawi Yarden lan ing pareden Hermon, saking ing redi Mizar.","(42-7) Jiwaku tertekan dalam diriku, sebab itu aku teringat kepada-Mu dari tanah sungai Yordan dan pegunungan Hermon, dari gunung Mizar."
663,Mazmur 42,7,"(42-8) Samodra agung nguwuh-uwuh dhateng sami samodra agung, sareng kaliyan kumrasaking grojogan Paduka; kawula karoban ing sakathahing ombak saha alun Paduka.",(42-8) Samudera raya berpanggil-panggilan dengan deru air terjun-Mu; segala gelora dan gelombang-Mu bergulung melingkupi aku.
664,Mazmur 42,8,"(42-9) Ing wayah rina Pangeran Yehuwah ndhawuhake sih-kadarman, sarta ing wayah bengi aku ngrepekake kekidungan, pandonga marang Gusti Allahing uripku.","(42-9) TUHAN memerintahkan kasih setia-Nya pada siang hari, dan pada malam hari aku menyanyikan nyanyian, suatu doa kepada Allah kehidupanku."
665,Mazmur 42,9,(42-10) Unjukku marang Allah peparangku mangkene: “Punapaa dene Paduka boten ngengeti kawula? Punapaa dene kawula kedah gesang kalayan mangangge bagor margi saking panganiayanipun satru?”,"(42-10) Aku berkata kepada Allah, gunung batuku: ""Mengapa Engkau melupakan aku? Mengapa aku harus hidup berkabung di bawah impitan musuh?"""
666,Mazmur 42,10,"(42-11) Tiyang ingkang nenacad kawula punika, kados nuwek-nuweka balung kawula, sadinten muput tansah wicanten dhateng kawula makaten: “Allahmu ana ing ngendi?”","(42-11) Seperti tikaman maut ke dalam tulangku lawanku mencela aku, sambil berkata kepadaku sepanjang hari: ""Di mana Allahmu?"""
667,Mazmur 42,11,"(42-12) Dhuh nyawaku, yagene kok tumungkul? Yagene kok ngolang-ngaling ana ing jeroku? Ngarep-arepa marang Gusti Allah! Awit Panjenengane dakpuji maneh, Panjenengane kang dadi Pitulunganku lan Allahku!","(42-12) Mengapa engkau tertekan, hai jiwaku, dan mengapa engkau gelisah di dalam diriku? Berharaplah kepada Allah! Sebab aku bersyukur lagi kepada-Nya, penolongku dan Allahku!"
668,Mazmur 44,0,MASMUR 44; Pasambate bangsa kang katindhes,Jeritan bangsa yang tertindas
669,Mazmur 44,1,"Kanggo lurah pasindhen. Saka bani Korakh. Kidung piwulang. (44-2) Dhuh Allah, kawula sampun mireng piyambak, saking para leluhur kawula ingkang sami nyariyosi kawula, bab pakaryan ingkang sampun Paduka tindakaken kala jamanipun, inggih kala jaman kina.","Untuk pemimpin biduan. Dari bani Korah. Nyanyian pengajaran. (44-2) Ya Allah, dengan telinga kami sendiri telah kami dengar, nenek moyang kami telah menceritakan kepada kami perbuatan yang telah Kaulakukan pada zaman mereka, pada zaman purbakala."
670,Mazmur 44,2,"(44-3) Bangsa sanes sampun sami Paduka tundhung piyambak kalayan asta Paduka, nanging para leluhur sami Paduka tanem, suku-suku bangsa sami Paduka damel sangsara, nanging para leluhur sami paduka dadosaken tangkar-tumangkar.","(44-3) Engkau sendiri, dengan tangan-Mu, telah menghalau bangsa-bangsa, tetapi mereka ini Kaubiarkan bertumbuh; suku-suku bangsa telah Kaucelakakan, tetapi mereka ini Kaubiarkan berkembang."
671,Mazmur 44,3,"(44-4) Amargi boten sarana pedhang anggenipun sami ngejegi nagari, sanes tanganipun ingkang murugaken unggul, nanging asta Paduka tengen, bau Paduka saha cahyaning wadana Paduka, sabab sami damel rena Paduka.","(44-4) Sebab bukan dengan pedang mereka menduduki negeri, bukan lengan mereka yang memberikan mereka kemenangan, melainkan tangan kanan-Mu dan lengan-Mu dan cahaya wajah-Mu, sebab Engkau berkenan kepada mereka."
672,Mazmur 44,4,"(44-5) Inggih Paduka piyambak punika ingkang jumeneng dados Raja saha Allah kawula, ingkang ndhawuhaken kaunggulanipun Yakub.",(44-5) Engkaulah Rajaku dan Allahku yang memerintahkan kemenangan bagi Yakub.
673,Mazmur 44,5,"(44-6) Kanthi pitulungan Paduka kawula saged ngrebahaken mengsah, sarta margi saking asma Paduka kawula saged ngiles-iles para tiyang ingkang nglawan kawula.","(44-6) Dengan Engkaulah kami menanduk para lawan kami, dengan nama-Mulah kami menginjak-injak orang-orang yang bangkit menyerang kami."
674,Mazmur 44,6,"(44-7) Amargi sanes panah kawula ingkang kawula andelaken, sanes pedhang kawula ingkang murugaken unggul,","(44-7) Sebab bukan kepada panahku aku percaya, dan pedangkupun tidak memberi aku kemenangan,"
675,Mazmur 44,7,"(44-8) nanging Paduka ingkang paring kaunggulan dhumateng kawula samangsa kawula nglawan mengsah, saha Paduka ingkang mirangaken tetiyang ingkang sami nyengiti kawula.","(44-8) tetapi Engkaulah yang memberi kami kemenangan terhadap para lawan kami, dan orang-orang yang membenci kami Kauberi malu."
676,Mazmur 44,8,"(44-9) Awit saking Gusti Allah kawula sadinten muput sami ngrepekaken kidung pamuji, sarta asma Paduka sami kawula puji ing salaminipun. (Selah)","(44-9) Karena Allah kami nyanyikan puji-pujian sepanjang hari, dan bagi nama-Mu kami mengucapkan syukur selama-lamanya. Sela"
677,Mazmur 44,9,"(44-10) Nanging sapunika kawula sami Paduka kipataken sarta Paduka kendel kemawon, kawula sami kawirangan. Paduka boten miyos ngirid lampahing wadya-bala kawula.","(44-10) Namun Engkau telah membuang kami dan membiarkan kami kena umpat, Engkau tidak maju bersama-sama dengan bala tentara kami."
678,Mazmur 44,10,(44-11) Paduka damel mundur kawula saking ngajenganing mengsah kawula lan tiyang ingkang sami nyengiti kawula sami njejarah.,"(44-11) Engkau membuat kami mundur dari pada lawan kami, dan orang-orang yang membenci kami mengadakan perampokan."
679,Mazmur 44,11,"(44-12) Kawula sami Paduka ulungaken kadosdene menda sembelehan, saha kawula sami Paduka sebar wonten ing antawisipun para bangsa.",(44-12) Engkau menyerahkan kami sebagai domba sembelihan dan menyerakkan kami di antara bangsa-bangsa.
680,Mazmur 44,12,(44-13) Umat Paduka Paduka sade kanthi lelahanan sarta boten mundhut bathi saking pepajenganipun.,(44-13) Engkau menjual umat-Mu dengan cuma-cuma dan tidak mengambil keuntungan apa-apa dari penjualan itu.
681,Mazmur 44,13,"(44-14) Kawula sami Paduka dadosaken cacadan tumrap ing tangga-tepalih kawula, kadamel gegujengan saha dipun wirang-wirangaken dening tiyang-tiyang ing sakiwa-tengen kawula.","(44-14) Engkau membuat kami menjadi cela bagi tetangga-tetangga kami, menjadi olok-olok dan cemooh bagi orang-orang sekeliling kami."
682,Mazmur 44,14,"(44-15) Kawula Paduka dadosaken pocapan wonten ing antawisipun para bangsa, tuwin jalaranipun para suku bangsa sami gedheg-gedheg.","(44-15) Engkau membuat kami menjadi sindiran di antara bangsa-bangsa, menyebabkan suku-suku bangsa menggeleng-geleng kepala."
683,Mazmur 44,15,"(44-16) Sadinten muput kanisthan kawula wonten ing ngajeng kawula, sarta rai kawula kasasaban ing kawirangan,","(44-16) Sepanjang hari aku dihadapkan dengan nodaku, dan malu menyelimuti mukaku,"
684,Mazmur 44,16,"(44-17) awit saking tembung-tembungipun tiyang ingkang nenacad saha nyenyamah, wonten ing ngajenging mengsah saha tiyang ingkang ambek remen males awon.","(44-17) karena kata-kata orang yang mencela dan menista, di hadapan musuh dan pendendam."
685,Mazmur 44,17,"(44-18) Sadaya wau sampun dhumawah ing badan kawula, nanging kawula boten kesupen dhumateng Paduka, inggih boten cidra dhumateng prasetya Paduka.","(44-18) Semuanya ini telah menimpa kami, tetapi kami tidak melupakan Engkau, dan tidak mengkhianati perjanjian-Mu."
686,Mazmur 44,18,"(44-19) Manah kawula sami boten mbangkang, saha lampah kawula sami boten nyleweng saking margi Paduka,","(44-19) Hati kami tidak membangkang dan langkah kami tidak menyimpang dari jalan-Mu,"
687,Mazmur 44,19,"(44-20) sanadyan Paduka sampun ngremuk kawula wonten ing tengahipun segawon ajag, saha Paduka nglimputi kawula kalayan pepeteng.","(44-20) walaupun Engkau telah meremukkan kami di tempat serigala, dan menyelimuti kami dengan kekelaman."
688,Mazmur 44,20,"(44-21) Saupami kawula sami kesupen dhateng asmanipun Gusti Allah kawula, lan ngegaraken tangan kawula dhumateng allah sanesipun,","(44-21) Seandainya kami melupakan nama Allah kami, dan menadahkan tangan kami kepada allah lain,"
689,Mazmur 44,21,(44-22) punapa Gusti Allah boten badhe nitipriksa ingkang kados makaten punika? Amargi Pangeran rak boten kesamaran wewadosing manah?,(44-22) masakan Allah tidak akan menyelidikinya? Karena Ia mengetahui rahasia hati!
690,Mazmur 44,22,"(44-23) Saestu, awit saking Paduka kawula sami wonten ing salebeting bebaya pejah ing saben dintenipun, saha kasamekaken kaliyan menda sembelehan.","(44-23) Oleh karena Engkau kami ada dalam bahaya maut sepanjang hari, kami dianggap sebagai domba-domba sembelihan."
