,bab,ayat,jawa,indo
1825,Mazmur 106,15,"Padha diuja kekarepane, nanging awake uga banjur diganjar lelara nglayung.","Diberikan-Nya kepada mereka apa yang mereka minta, dan didatangkan-Nya penyakit paru-paru di antara mereka."
1826,Mazmur 106,16,"Sawuse mangkono padha meri marang Nabi Musa ana ing pakemahan, tuwin marang Imam Harun, abdining Pangeran Yehuwah kang suci.","Mereka cemburu kepada Musa di perkemahan, dan kepada Harun, orang kudus TUHAN."
1827,Mazmur 106,17,"Bumi tumuli bengkah nguntal Dhatan, sarta ngingkemi grombolane Abiram.","Bumi terbuka dan menelan Datan, menutupi kumpulan Abiram."
1828,Mazmur 106,18,"Ana geni kang mulad-mulad ing tengahe grombolan mau, lan urube nggesengake para wong kang duraka iku.","Api menyala di kalangan mereka, nyala api menghanguskan orang-orang fasik itu."
1829,Mazmur 106,19,"Ana ing gunung Horeb padha gawe reca pedhet, sarta sujud marang reca cithakan;","Mereka membuat anak lembu di Horeb, dan sujud menyembah kepada patung tuangan;"
1830,Mazmur 106,20,padha ngijolake Kamulyane kalawan wewujudan sapi lanang kang mangan suket.,mereka menukar Kemuliaan mereka dengan bangunan sapi jantan yang makan rumput.
1831,Mazmur 106,21,"Padha lali marang Gusti Allah juru Pangluwarane, kang wus nindakake prakara-prakara kang gedhe ana ing tanah Mesir;","Mereka melupakan Allah yang telah menyelamatkan mereka, yang telah melakukan hal-hal yang besar di Mesir:"
1832,Mazmur 106,22,"pandamel-pandamel kang elok ana ing tanahe Kham, pandamel-pandamel kang nggegirisi ana ing sapinggire segara Teberau.","perbuatan-perbuatan ajaib di tanah Ham, perbuatan-perbuatan dahsyat di tepi Laut Teberau."
1833,Mazmur 106,23,"Mulane Pangeran ngandika bakal numpes para leluhur, yen ajaa Nabi Musa pepilihane, nengahi ana ing ngarsaning Pangeran, nyirep bebendune temah Panjenengane ora sida nyirnakake para leluhur.","Maka Ia mengatakan hendak memusnahkan mereka, kalau Musa, orang pilihan-Nya, tidak mengetengahi di hadapan-Nya, untuk menyurutkan amarah-Nya, sehingga Ia tidak memusnahkan mereka."
1834,Mazmur 106,24,"Para leluhur padha ngemohi negara kang adi iku, padha ora ngandel marang pangandikane,","Mereka menolak negeri yang indah itu, tidak percaya kepada firman-Nya."
1835,Mazmur 106,25,"malah padha pating kedumel ana ing kemahe, lan ora ngrungokake marang swantene Pangeran Yehuwah,",Mereka menggerutu di kemahnya dan tidak mendengarkan suara TUHAN.
1836,Mazmur 106,26,"mulane Pangeran banjur ngagagake astane marang para leluhur, arep padha dipateni ana ing ara-ara samun,","Lalu Ia mengangkat tangan-Nya terhadap mereka untuk meruntuhkan mereka di padang gurun,"
1837,Mazmur 106,27,"sarta turune bakal padha dibuyarake ana ing antarane para bangsa, lan disebar menyang ing negara-negara.","dan untuk mencerai-beraikan anak cucu mereka ke antara bangsa-bangsa, dan menyerakkan mereka ke pelbagai negeri."
1838,Mazmur 106,28,"Apadene padha rumaket marang Baal-Peor, sarta mangan kurban-kurban sembelehan kanggo wong mati.","Mereka berpaut pada Baal Peor, dan memakan korban-korban sembelihan bagi orang mati."
1839,Mazmur 106,29,"Dadi padha gawe gerahe panggalihe Pangeran Yehuwah marga saka pratingkahe mau, mulane padha katempuh ing wewelak.","Mereka menyakiti hati-Nya dengan perbuatan mereka, maka timbullah tulah di antara mereka."
1840,Mazmur 106,30,"Pinehas tumuli tumandang nindakake pangadilan, temah wewelak mau banjur sirep.","Tetapi Pinehas berdiri dan menjalankan hukum, maka berhentilah tulah itu."
1841,Mazmur 106,31,Bab iku kapetung dadi jasane turun-tumurun ing salawas-lawase.,"Hal itu diperhitungkan kepadanya sebagai jasa turun-temurun, untuk selama-lamanya."
1842,Mazmur 106,32,"Ana ing sacedhake banyu ing Meriba, para leluhur padha gawe dukaning Allah, satemah Nabi Musa banjur ketaman ing karubedan, marga saka para leluhur mau,","Mereka menggusarkan Dia dekat air Meriba, sehingga Musa kena celaka karena mereka;"
1843,Mazmur 106,33,"amarga para leluhur padha njalari dukane Nabi Musa, nganti panjenengane ketrucut anggone ngandika.","sebab mereka memahitkan hatinya, sehingga ia teledor dengan kata-katanya."
1844,Mazmur 106,34,"Para bangsa padha ora dibengkas, kaya kang wus kadhawuhake dening Pangeran Yehuwah marang para leluhur,","Mereka tidak memunahkan bangsa-bangsa, seperti yang diperintahkan TUHAN kepada mereka,"
1845,Mazmur 106,35,"nanging padha tetunggalan karo para bangsa mau, lan niru pratingkahe,","tetapi mereka bercampur baur dengan bangsa-bangsa, dan belajar cara-cara mereka bekerja."
1846,Mazmur 106,36,"brahalane padha disembah, temah dadi kalajiret tumrap para leluhur.","Mereka beribadah kepada berhala-berhala mereka, yang menjadi perangkap bagi mereka."
1847,Mazmur 106,37,"Padha ngurbanake anak-anake lanang, lan anak-anake wadon marang para roh reged,","Mereka mengorbankan anak-anak lelaki mereka, dan anak-anak perempuan mereka kepada roh-roh jahat,"
1848,Mazmur 106,38,"dadi padha ngwutahake getihe wong kang ora luput, iya iku getihe anake lanang lan wadon, kang padha disembeleh dadi sesajen marang brahalane wong Kanaan, temah negara kono banjur najis awit saka anggone utang getih mau.","dan menumpahkan darah orang yang tak bersalah, darah anak-anak lelaki dan anak-anak perempuan mereka, yang mereka korbankan kepada berhala-berhala Kanaan, sehingga negeri itu cemar oleh hutang darah."
1849,Mazmur 106,39,"Padha najisake awake dhewe srana pratingkahe iku, sarta padha laku jina ing sajroning panggawene mau.","Mereka menajiskan diri dengan apa yang mereka lakukan, dan berzinah dalam perbuatan-perbuatan mereka."
1850,Mazmur 106,40,"Mulane bebenduning Pangeran Yehuwah mulad-mulad marang umate, sarta ewa marang bangsa kagungane piyambak iku,","Maka menyalalah murka TUHAN terhadap umat-Nya, dan Ia jijik kepada milik-Nya sendiri."
1851,Mazmur 106,41,"banjur padha diulungake marang ing tangane bangsa liyan, satemah kawasesa ing wong kang padha nyengiti.","Diserahkan-Nyalah mereka ke tangan bangsa-bangsa, sehingga orang-orang yang membenci mereka berkuasa atas mereka."
1852,Mazmur 106,42,"Padha kaindhes-indhes dening mungsuhe, satemah teluk marang ing pangwasane.","Mereka diimpit oleh musuhnya, sehingga takluk ke bawah kuasanya."
1853,Mazmur 106,43,"Wus bola-bali anggone padha dipitulungi dening Gusti Allah, nanging padha mbalela wae kanthi rancangan-rancangane, padha kerem ing sajroning kaluputane.","Banyak kali dilepaskan-Nya mereka, tetapi mereka bersikap memberontak dengan rencana-rencana mereka, tenggelam dalam kesalahan mereka."
1854,Mazmur 106,44,"Ewadene Gusti Allah mirsani ing karubedane, nalika miyarsa pasambate.","Namun Ia menilik kesusahan mereka, ketika Ia mendengar teriak mereka."
1855,Mazmur 106,45,"Panjenengane enget marang prasetyane marga saka para leluhur mau, temah kaduwung marga saka gedhening sih-kadarmane.","Ia ingat akan perjanjian-Nya karena mereka, dan menyesal sesuai dengan kasih setia-Nya yang besar."
1856,Mazmur 106,46,Padha diparengake oleh kawelasan saka ing sakehing wong kang padha nawan.,Diberi-Nya mereka mendapat rahmat dari pihak semua orang yang menawan mereka.
1857,Mazmur 106,47,"Dhuh Yehuwah, Gusti Allah kawula, kawula mugi Paduka luwari, sami kaklempakna saking ing antawisipun para bangsa, supados kawula sami ngucap sokur dhumateng asma Paduka ingkang suci, sami ageng ing manah kalayan ngaturaken pepujian dhumateng Paduka.","Selamatkanlah kami, ya TUHAN, Allah kami, dan kumpulkanlah kami dari antara bangsa-bangsa, supaya kami bersyukur kepada nama-Mu yang kudus, dan bermegah dalam puji-pujian kepada-Mu."
1858,Mazmur 106,48,"Pinujia Pangeran Yehuwah, Gusti Allahe Israel, saka ing kalanggengan tumeka ing kalanggengan sarta umate kabeh padha ngucapa: “Amin!” Haleluya!","Terpujilah TUHAN, Allah Israel, dari selama-lamanya sampai selama-lamanya, dan biarlah seluruh umat mengatakan: ""Amin!"" Haleluya!"
1859,Mazmur 107,0,JILID V: MASMUR 107-150; Kidung panuwun rerepene para wong kang tinebus dening Pangeran Yehuwah,Nyanyian syukur dari orang-orang yang ditebus TUHAN
1860,Mazmur 107,1,"Padha saosa puji sokur marang Sang Yehuwah, awitdene Panjenengane iku sae! Ujer sih-susetyane iku langgeng ing salawase.","Bersyukurlah kepada TUHAN, sebab Ia baik! Bahwasanya untuk selama-lamanya kasih setia-Nya."
1861,Mazmur 107,2,"Mangkono pangucape para wong kang padha katebus dening Yehuwah, kang ditebus saka ing pangwasane kang gawe susah,","Biarlah itu dikatakan orang-orang yang ditebus TUHAN, yang ditebus-Nya dari kuasa yang menyesakkan,"
1862,Mazmur 107,3,"kang dikumpulake saka ing nagara-nagara, saka ing tanah wetan lan kulon, saka ing lor lan saka ing kidul.","yang dikumpulkan-Nya dari negeri-negeri, dari timur dan dari barat, dari utara dan dari selatan."
1863,Mazmur 107,4,"Ana wong kang padha nglambrang ana ing ara-ara samun, ora nemu dalan kang anjog marang ing kutha kang dienggoni ing wong.","Ada orang-orang yang mengembara di padang belantara, jalan ke kota tempat kediaman orang tidak mereka temukan;"
1864,Mazmur 107,5,"padha kaluwen lan kasatan, nyawane kasulayah banget.","mereka lapar dan haus, jiwa mereka lemah lesu di dalam diri mereka."
1865,Mazmur 107,6,"Sajroning karubedane mau nuli padha sesambat marang Pangeran Yehuwah, banjur padha diluwari saka ing sangsarane,","Maka berseru-serulah mereka kepada TUHAN dalam kesesakan mereka, dan dilepaskan-Nya mereka dari kecemasan mereka."
1866,Mazmur 107,7,"ditedahi dalan kang bener, temah banjur tekan ing kutha kang dienggoni ing wong.","Dibawa-Nya mereka menempuh jalan yang lurus, sehingga sampai ke kota tempat kediaman orang."
1867,Mazmur 107,8,"Wong mau kareben padha ngaturake panuwun marang Sang Yehuwah, marga saka sih-susetyane, marga saka kaelokane marang para anaking manungsa,","Biarlah mereka bersyukur kepada TUHAN karena kasih setia-Nya, karena perbuatan-perbuatan-Nya yang ajaib terhadap anak-anak manusia,"
1868,Mazmur 107,9,"awitdene Pangeran karsa maregi nyawane wong kang kasatan, sarta nyawa kang kaluwen kawaregan ing kabecikan.","sebab dipuaskan-Nya jiwa yang dahaga, dan jiwa yang lapar dikenyangkan-Nya dengan kebaikan."
1869,Mazmur 107,10,"Ana wong kang padha ana ing pepeteng lan ing palimengan, kinurung ing sangsara lan wesi.","Ada orang-orang yang duduk di dalam gelap dan kelam, terkurung dalam sengsara dan besi."
1870,Mazmur 107,11,"Sarehne padha mbalela marang pepakoning Allah, sarta ngremehake marang pitadahe Kang Mahaluhur,","Karena mereka memberontak terhadap perintah-perintah Allah, dan menista nasihat Yang Mahatinggi,"
1871,Mazmur 107,12,"mulane ditelukake atine kalawan kasusahan, padha kejlungup, ora ana kang mitulungi.","maka ditundukkan-Nya hati mereka ke dalam kesusahan, mereka tergelincir, dan tidak ada yang menolong."
1872,Mazmur 107,13,"Ing sajroning karubedane iku, bareng padha sesambat marang Pangeran Yehuwah, banjur padha diluwari saka ing kasangsarane,","Maka berseru-serulah mereka kepada TUHAN dalam kesesakan mereka, dan diselamatkan-Nyalah mereka dari kecemasan mereka,"
1873,Mazmur 107,14,"diluwari saka ing pepeteng lan palimengan, sarta ranten padha dipedhoti.","dibawa-Nya mereka keluar dari dalam gelap dan kelam, dan diputuskan-Nya belenggu-belenggu mereka."
1874,Mazmur 107,15,"Wong iku kareben padha ngaturake panuwun marang Pangeran Yehuwah awit saka sih-susetyane, lan kaelokane marang para anaking manungsa;","Biarlah mereka bersyukur kepada TUHAN karena kasih setia-Nya, karena perbuatan-perbuatan-Nya yang ajaib terhadap anak-anak manusia,"
1875,Mazmur 107,16,"awit Pangeran wus karsa mbejadi lawang-lawang tembaga, sarta nugeli slarak-slarake wesi.","sebab dipecahkan-Nya pintu-pintu tembaga, dan dihancurkan-Nya palang-palang pintu besi."
1876,Mazmur 107,17,"Ana wong kang padha nandhang lara awit saka panggawene kang dosa, lan siniksa marga saka kaluputane.","Ada orang-orang menjadi sakit oleh sebab kelakuan mereka yang berdosa, dan disiksa oleh sebab kesalahan-kesalahan mereka;"
1877,Mazmur 107,18,"Wis padha bosen marang sarupaning pangan, lan wus padha tekan ing gapuraning pati.",mereka muak terhadap segala makanan dan mereka sudah sampai pada pintu gerbang maut.
1878,Mazmur 107,19,"Ing sajroning karupekane mau nuli padha sesambat marang Sang Yehuwah, banjur padha diluwari saka ing kasusahane.","Maka berseru-serulah mereka kepada TUHAN dalam kesesakan mereka, dan diselamatkan-Nya mereka dari kecemasan mereka,"
1879,Mazmur 107,20,"Pangeran paring pangandika sarta tumuli padha diwaluyakake, padha oncat saka ing luwenging kubur.","disampaikan-Nya firman-Nya dan disembuhkan-Nya mereka, diluputkan-Nya mereka dari liang kubur."
1880,Mazmur 107,21,"Wong iku mau kareben padha ngaturake panuwun marang Pangeran Yehuwah, awit saka sih-kadarmane, lan marga saka kaelokane marang para anaking manungsa,","Biarlah mereka bersyukur kepada TUHAN karena kasih setia-Nya, karena perbuatan-perbuatan-Nya yang ajaib terhadap anak-anak manusia."
1881,Mazmur 107,22,sarta kareben padha nyaosake kurban pamuji sokur tuwin nyaritakake pakaryane Gusti Allah kalawan surak-surak.,"Biarlah mereka mempersembahkan korban syukur, dan menceritakan pekerjaan-pekerjaan-Nya dengan sorak-sorai!"
1882,Mazmur 107,23,"Ana wong kang nyabrangi segara kalawan prau, kang laku dagang ana ing samodra kang nglangut,","Ada orang-orang yang mengarungi laut dengan kapal-kapal, yang melakukan perdagangan di lautan luas;"
1883,Mazmur 107,24,padha ndeleng pakaryaning Sang Yehuwah lan pandamele kang elok ana ing telenging segara.,"mereka melihat pekerjaan-pekerjaan TUHAN, dan perbuatan-perbuatan-Nya yang ajaib di tempat yang dalam."
1884,Mazmur 107,25,"Pangeran ngandika sarta ndhatengake prahara, kang ngumbulake ombak-ombake,","Ia berfirman, maka dibangkitkan-Nya angin badai yang meninggikan gelombang-gelombangnya."
1885,Mazmur 107,26,"wonge padha mumbul tekan ing langit lan padha mudhun marang ing samodra gedhe, nyawane remuk marga saka kacilakan iku,","Mereka naik sampai ke langit dan turun ke samudera raya, jiwa mereka hancur karena celaka;"
1886,Mazmur 107,27,"padha mumet lan sempoyongan kaya wong mendem, sarta entek akale.","mereka pusing dan terhuyung-huyung seperti orang mabuk, dan kehilangan akal."
1887,Mazmur 107,28,"Ing sajroning karubedane iku nuli padha sesambat marang Pangeran Yehuwah, banjur padha diluwari saka ing karubedane;","Maka berseru-serulah mereka kepada TUHAN dalam kesesakan mereka, dan dikeluarkan-Nya mereka dari kecemasan mereka,"
1888,Mazmur 107,29,praharane kasirep lan ombake segara padha anteng.,"dibuat-Nyalah badai itu diam, sehingga gelombang-gelombangnya tenang."
1889,Mazmur 107,30,"Wong-wong mau padha bungah, awit kaanane kabeh wus tentrem, sarta banjur dituntun menyang ing pelabuhan kang disenengi.","Mereka bersukacita, sebab semuanya reda, dan dituntun-Nya mereka ke pelabuhan kesukaan mereka."
1890,Mazmur 107,31,"Wong iku kareben padha ngaturake panuwun marang Yehuwah, awit saka sih-susetyane, marga saka kaelokane marang para anaking manungsa.","Biarlah mereka bersyukur kepada TUHAN karena kasih setia-Nya, karena perbuatan-perbuatan-Nya yang ajaib terhadap anak-anak manusia."
1891,Mazmur 107,32,"Wong mau kareben padha ngluhurake Pangeran ana ing pasamuwaning umat iku, sarta memuji marang Panjenengane ana ing pakumpulane para pinituwa.","Biarlah mereka meninggikan Dia dalam jemaat umat itu, dan memuji-muji Dia dalam majelis para tua-tua."
1892,Mazmur 107,33,"Kali-kali kadadekake segara wedhi, sarta tuking banyu didadekake lemah cengkar,","Dibuat-Nya sungai-sungai menjadi padang gurun, dan pancaran-pancaran air menjadi tanah gersang,"
1893,Mazmur 107,34,"tanah subur didadekake bumi asin, kang mangkono iku awit saka pialane wong kang padha ngenggoni,","tanah yang subur menjadi padang asin, oleh sebab kejahatan orang-orang yang diam di dalamnya."
1894,Mazmur 107,35,"ara-ara samun kadadekake blumbang, tuwin tanah cengkar didadekake sumber,","Dibuat-Nya padang gurun menjadi kolam air, dan tanah kering menjadi pancaran-pancaran air."
1895,Mazmur 107,36,"wong kang keluwen banjur padha dinungake ana ing kono, nuli padha mbangun kutha kang dienggoni,","Ditempatkan-Nya di sana orang-orang lapar, dan mereka mendirikan kota tempat kediaman;"
1896,Mazmur 107,37,"tumuli padha nyebar ana ing pategalan lan gawe pakebonan anggur, kang metokake woh-wohan minangka pametune.","mereka menabur di ladang-ladang dan membuat kebun-kebun anggur, yang mengeluarkan buah-buahan sebagai hasil."
1897,Mazmur 107,38,"Anadene wong iku padha banget diberkahi dening Pangeran, temah banjur banget anggone ngambra-ambra, tuwin raja-kayane padha didadekake nak-kumanak.","Diberkati-Nya mereka sehingga mereka bertambah banyak dengan sangat, dan hewan-hewan mereka tidak dibuat-Nya berkurang."
1898,Mazmur 107,39,"Nanging banjur suda-suda lan ngrekasa, awit saka pameteking sangsara lan kasusahan.",Tetapi mereka menjadi berkurang dan membungkuk oleh sebab tekanan celaka dan duka.
1899,Mazmur 107,40,"Pangeran banjur ngesoki kawirangan marang para panggedhe, padha kadadekake nglambrang ana ing pasamunan, kang ora ana dalane.","Ditumpahkan-Nya kehinaan ke atas orang-orang terkemuka, dan dibuat-Nya mereka mengembara di padang tandus yang tiada jalan;"
1900,Mazmur 107,41,"Nanging wong mlarat padha diayomi supaya ora katindhes, sarta anak-putune padha ditangkar-tangkarake kaya pepanthan wedhus kehe.","tetapi orang miskin dibentengi-Nya terhadap penindasan, dan dibuat-Nya kaum-kaum mereka seperti kawanan domba banyaknya."
1901,Mazmur 107,42,"Para wong mursid padha weruh banjur padha bungah, nanging sakehing kaculikan padha mingkem.","Orang-orang benar melihatnya, lalu bersukacita, tetapi segala kecurangan tutup mulut."
1902,Mazmur 107,43,"Sapa wong kang wicaksana? Iku becik gondhelana marang prakara iku kabeh, sarta nggatekna marang sih-kadarmaning Yehuwah.","Siapa yang mempunyai hikmat? Biarlah ia berpegang pada semuanya ini, dan memperhatikan segala kemurahan TUHAN."
1903,Mazmur 108,0,MASMUR 108; Pangucap sokur lan pandonga,Syukur dan doa
1904,Mazmur 108,1,"Kidung. Masmur anggitane Prabu Dawud. (108-2) Manah kawula sampun cumawis, dhuh Allah, kawula badhe ngidung, kawula badhe ngrepekaken masmur. Tangia, heh nyawaku.","Nyanyian. Mazmur Daud. (108-2) Hatiku siap, ya Allah, aku mau menyanyi, aku mau bermazmur. Bangunlah, hai jiwaku,"
1905,Mazmur 108,2,(108-3) He slukat lan clempung padha tangia! bangbang wetan arep dakgugah.,"(108-3) bangunlah, hai gambus dan kecapi, aku mau membangunkan fajar."
1906,Mazmur 108,3,"(108-4) Kawula badhe ngunjukaken pamuji sokur dhumateng Paduka wonten ing satengahipun para bangsa, dhuh Yehuwah saha badhe ngidungaken masmur kagem Paduka wonten ing tengahipun para suku bangsa;","(108-4) Aku mau bersyukur kepada-Mu di antara bangsa-bangsa, ya TUHAN, dan aku mau bermazmur bagi-Mu di antara suku-suku bangsa;"
1907,Mazmur 108,4,"(108-5) awit sih-kadarman Paduka punika agengipun ngungkuli langit, saha kasetyan Paduka ngantos sundhul ing mega.","(108-5) sebab kasih-Mu besar mengatasi langit, dan setia-Mu sampai ke awan-awan."
1908,Mazmur 108,5,"(108-6) Dhuh Allah, Paduka mugi karsaa ngluhuraken sarira ngantos ngungkuli langit, saha kamulyan Paduka supados ngungkulana bumi sadaya.","(108-6) Tinggikanlah diri-Mu mengatasi langit, ya Allah, dan biarlah kemuliaan-Mu mengatasi seluruh bumi."
1909,Mazmur 108,6,"(108-7) Supados para kekasih paduka sami saged oncat; mugi Paduka kersaa maringi pangluwaran klayan asta Paduka tengen, saha kersaa paring wangsulan dhumateng kawula.","(108-7) Supaya terluput orang-orang yang Kaucintai, selamatkanlah dengan tangan kanan-Mu dan jawablah aku!"
1910,Mazmur 108,7,"(108-8) Gusti Allah wus ngandika ana ing pasucene: “Ingsun arsa surak-surak; tanah Sikhem bakal Sunbagi-bagi, lebak Sukot arep Sunukur,","(108-8) Allah telah berfirman di tempat kudus-Nya: ""Aku hendak beria-ria, Aku hendak membagi-bagikan Sikhem, dan lembah Sukot hendak Kuukur."
1911,Mazmur 108,8,"(108-9) Gilead iku kagunganingSun, Manasye iku kagunganingSun, Efraim iku tetoponging mastakaningSun, Yahuda iku jungkating kapraboningSun,","(108-9) Gilead punya-Ku, Manasye punya-Ku, Efraim ialah pelindung kepala-Ku, Yehuda ialah tongkat kerajaan-Ku,"
1912,Mazmur 108,9,"(108-10) Moab iku papan pawijikaningSun, Edom Sununcali trumpahingSun, lan marga saka tanah Filisti Ingsun asurak-surak.”","(108-10) Moab ialah tempat pembasuhan-Ku, kepada Edom Aku melemparkan kasut-Ku, dan karena Filistea Aku bersorak-sorai."""
1913,Mazmur 108,10,(108-11) Sapa kang bakal ngirid aku lumebu marang kutha kang santosa? Sapa kang nuntun aku menyang ing tanah Edom?,(108-11) Siapakah yang akan membawa aku ke kota yang berkubu? Siapakah yang menuntun aku ke Edom?
1914,Mazmur 108,11,"(108-12) Dhuh Allah, punapa sanes Paduka piyambak ingkang sampun nampik kawula, sarta boten miyos sesarengan kaliyan bala kawula, dhuh Allah?","(108-12) Bukankah Engkau, ya Allah, yang telah membuang kami, dan yang tidak maju, ya Allah, bersama-sama bala tentara kami?"
1915,Mazmur 108,12,"(108-13) Paduka mugi karsaa paring pitulungan nglawan mengsah, awit pambiyantunipun manungsa punika tanpa gina.","(108-13) Berikanlah kepada kami pertolongan terhadap lawan, sebab sia-sia penyelamatan dari manusia."
1916,Mazmur 108,13,"(108-14) Marga saka Gusti Allah, kita bakal padha nindakake panggawe-panggawe kang prawira, sarta Gusti Allah piyambak bakal ngiles-iles para mungsuh kita.","(108-14) Dengan Allah akan kita lakukan perbuatan-perbuatan gagah perkasa, sebab Ia sendiri akan menginjak-injak para lawan kita."
1917,Mazmur 109,0,MASMUR 109; Pandongane wong kang kapitenah,Doa seorang yang kena fitnah
1918,Mazmur 109,1,"Kanggo lurah pasindhen. Masmur anggitane Parabu Dawud. Dhuh Allah pepujan kawula, Paduka mugi sampun kendel,","Untuk pemimpin biduan. Mazmur Daud. Ya Allah pujianku, janganlah berdiam diri!"
1919,Mazmur 109,2,"awitdene cangkemipun tiyang duraka kaliyan cangkemipun tiyang cidra kaangapaken dhateng kawula, sarta kawula dipun ungel-ungeli kaliyan ilat dora,","Sebab mulut orang fasik dan mulut penipu ternganga terhadap aku, mereka berbicara terhadap aku dengan lidah dusta;"
1920,Mazmur 109,3,"kawula dipun tempuh klayan tembung-tembung sesengitan, saha dipun perangi tanpa sabab.",dengan kata-kata kebencian mereka menyerang aku dan memerangi aku tanpa alasan.
1921,Mazmur 109,4,"Minangka piwales tumrap katresnan kawula sami nggigat kawula, mangka sami kawula dongakaken,","Sebagai balasan terhadap kasihku mereka menuduh aku, sedang aku mendoakan mereka."
1922,Mazmur 109,5,"kasaenan kawula dipun wales piawon, saha katresnan kawula kawales sengit.",Mereka membalas kejahatan kepadaku ganti kebaikan dan kebencian ganti kasihku.
1923,Mazmur 109,6,“Netepna tiyang duraka ingkang masesani piyambakipun lan tukang nggigat wonten ing sisih tengenipun.,"""Angkatlah seorang fasik atas dia, dan biarlah seorang pendakwa berdiri di sebelah kanannya;"
1924,Mazmur 109,7,"Samangsa dipun adili katetepna kalepatanipun, saha pandonganipun kaanggepa dosa;","apabila dihakimi, biarlah ia keluar sebagai orang bersalah, dan biarlah doanya menjadi dosa."
1925,Mazmur 109,8,"umuripun kacelakna, kalenggahanipun kaalapa dening tiyang sanes;","Biarlah umurnya berkurang, biarlah jabatannya diambil orang lain."
1926,Mazmur 109,9,"anakipun sami dadosa lola, tuwin semahipun dadosa randha.","Biarlah anak-anaknya menjadi yatim, dan isterinya menjadi janda."
1927,Mazmur 109,10,"Anak-anakipun kajengipun nglambrang boten kantenan lan ngemis, sarta katundhung saking jugruganing griyanipun.","Biarlah anak-anaknya mengembara tidak keruan dan mengemis, dan dihalau dari reruntuhan rumahnya."
1928,Mazmur 109,11,"Ingkang potang mbeslaha sabarang darbekipun, sarta tiyang sanes sami ngrayaha angsal-angsalaning ngrekaosipun;","Biarlah penagih hutang menyita segala kepunyaannya, dan orang-orang lain menjarah hasil jerih payahnya."
1929,Mazmur 109,12,"sampun ngantos lestantun manggih sih piwelasipun tiyang, saha sampun ngantos wonten ingkang melasi dhateng anakipun ingkang sampun dados lola;","Janganlah ada orang yang tetap menunjukkan kasihnya kepadanya, dan janganlah ada orang yang sayang kepada anak-anaknya yang menjadi yatim."
1930,Mazmur 109,13,"saturunipun sami tumpesa, tuwin namanipun kasirnakna ing turun candhakipun,","Biarlah dilenyapkan keturunannya, dan dihapuskan namanya dalam angkatan yang kemudian."
1931,Mazmur 109,14,"piawoning para leluhuripun kaengetana wonten ing ngarsaning Yehuwah, sarta dosaning biyungipun sampun ngantos kalebur,","Biarlah kesalahan nenek moyangnya diingat-ingat di hadapan TUHAN, dan janganlah dihapuskan dosa ibunya."
1932,Mazmur 109,15,"kajengipun tansah kagalih dening Pangeran Yehuwah, supados pangenget-enget dhateng tiyang punika dipun bengkas saking bumi,","Biarlah itu selalu diperhatikan TUHAN, supaya ingatan kepada mereka dilenyapkan dari bumi."
1933,Mazmur 109,16,"awitdene boten enget nindakaken katresnan, nanging ngoyak-oyak tiyang ingkang kesrakat sarta mlarat tuwin ingkang pepes manahipun ngantos sami nemahi pejah.","Oleh karena ia tidak ingat menunjukkan kasih, tetapi mengejar orang sengsara dan miskin dan orang yang hancur hati sampai mereka mati."
1934,Mazmur 109,17,"Sarehning remen ngucapaken ipat-ipat, mila sami katamana ing ipat-ipatipun piyambak; sarehning boten remen dhateng berkah, mila mugi berkah inggih nebiha saking piyambakipun.",Ia cinta kepada kutuk--biarlah itu datang kepadanya; ia tidak suka kepada berkat--biarlah itu menjauh dari padanya.
1935,Mazmur 109,18,"Ipat-ipat dipun angge kados rasukan, mila rumesepa ing badanipun kados toya, tuwin kados lisah ing balungipun,","Ia memakai kutuk sebagai bajunya--biarlah itu merembes seperti air ke dalam dirinya, dan seperti minyak ke dalam tulang-tulangnya;"
1936,Mazmur 109,19,"inggih dadosa kados sandhangan ingkang dipun angge, sarta sabuk ingkang tansah dipun angge.","biarlah itu baginya seperti pakaian yang dikenakannya, sebagai ikat pinggang yang senantiasa dipakainya."
